16:01:15.043818 00:50:56:c0:00:08 > ff:ff:ff:ff:ff:ff, ethertype ARP (0x0806), length 60: Request who-has 192.168.85.2 tell 192.168.85.1, length 46
16:01:15.857134 00:0c:29:9d:69:42 > 00:50:56:ef:62:54, ethertype IPv4 (0x0800), length 90: 192.168.85.129.48803 > 185.125.190.57.123: NTPv4, Client, length 48
16:01:16.085853 00:50:56:ef:62:54 > 00:0c:29:9d:69:42, ethertype IPv4 (0x0800), length 90: 185.125.190.57.123 > 192.168.85.129.48803: NTPv4, Server, length 48
16:01:16.243111 00:50:56:c0:00:08 > ff:ff:ff:ff:ff:ff, ethertype ARP (0x0806), length 60: Request who-has 192.168.85.2 tell 192.168.85.1, length 46
16:01:17.039001 00:50:56:c0:00:08 > ff:ff:ff:ff:ff:ff, ethertype ARP (0x0806), length 60: Request who-has 192.168.85.2 tell 192.168.85.1, length 46
16:01:18.032630 00:50:56:c0:00:08 > ff:ff:ff:ff:ff:ff, ethertype ARP (0x0806), length 60: Request who-has 192.168.85.2 tell 192.168.85.1, length 46
16:01:18.918880 00:0c:29:9d:69:42 > 00:50:56:ef:62:54, ethertype IPv4 (0x0800), length 89: 192.168.85.129.60780 > 192.168.85.2.53: 27397+ A? connectivity-check.ubuntu.com. (47)
16:01:18.928399 00:50:56:ef:62:54 > 00:0c:29:9d:69:42, ethertype IPv4 (0x0800), length 449: 192.168.85.2.53 > 192.168.85.129.60780: 27397 12/3/5 A 185.125.190.96, A 185.125.190.48, A 91.189.91.48, A 185.125.190.49, A 91.189.91.98, A 185.125.190.97, A 91.189.91.49, A 185.125.190.18, A 185.125.190.98, A 91.189.91.97, A 185.125.190.17, A 91.189.91.96 (407)
16:01:18.930529 00:0c:29:9d:69:42 > 00:50:56:ef:62:54, ethertype IPv4 (0x0800), length 74: 192.168.85.129.59602 > 185.125.190.96.80: Flags [S], seq 2693689678, win 64240, options [mss 1460,sackOK,TS val 509824754 ecr 0,nop,wscale 7], length 0
16:01:19.182078 00:50:56:ef:62:54 > 00:0c:29:9d:69:42, ethertype IPv4 (0x0800), length 60: 185.125.190.96.80 > 192.168.85.129.59602: Flags [S.], seq 240454252, ack 2693689679, win 64240, options [mss 1460], length 0
16:01:19.182220 00:0c:29:9d:69:42 > 00:50:56:ef:62:54, ethertype IPv4 (0x0800), length 54: 192.168.85.129.59602 > 185.125.190.96.80: Flags [.], ack 1, win 64240, length 0
16:01:19.182566 00:0c:29:9d:69:42 > 00:50:56:ef:62:54, ethertype IPv4 (0x0800), length 141: 192.168.85.129.59602 > 185.125.190.96.80: Flags [P.], seq 1:88, ack 1, win 64240, length 87: HTTP: GET / HTTP/1.1
16:01:19.183417 00:50:56:ef:62:54 > 00:0c:29:9d:69:42, ethertype IPv4 (0x0800), length 60: 185.125.190.96.80 > 192.168.85.129.59602: Flags [.], ack 88, win 64240, length 0
16:01:19.385651 00:50:56:ef:62:54 > ff:ff:ff:ff:ff:ff, ethertype ARP (0x0806), length 60: Request who-has 192.168.85.129 tell 192.168.85.2, length 46
16:01:19.385673 00:0c:29:9d:69:42 > 00:50:56:ef:62:54, ethertype ARP (0x0806), length 42: Reply 192.168.85.129 is-at 00:0c:29:9d:69:42, length 28
16:01:19.386521 00:50:56:ef:62:54 > 00:0c:29:9d:69:42, ethertype IPv4 (0x0800), length 239: 185.125.190.96.80 > 192.168.85.129.59602: Flags [FP.], seq 1:186, ack 88, win 64240, length 185: HTTP: HTTP/1.1 204 No Content
16:01:19.386847 00:0c:29:9d:69:42 > 00:50:56:ef:62:54, ethertype IPv4 (0x0800), length 54: 192.168.85.129.59602 > 185.125.190.96.80: Flags [F.], seq 88, ack 187, win 64054, length 0
16:01:19.387467 00:50:56:ef:62:54 > 00:0c:29:9d:69:42, ethertype IPv4 (0x0800), length 60: 185.125.190.96.80 > 192.168.85.129.59602: Flags [.], ack 89, win 64239, length 0
16:01:23.786195 00:50:56:c0:00:08 > ff:ff:ff:ff:ff:ff, ethertype ARP (0x0806), length 60: Request who-has 192.168.85.2 tell 192.168.85.1, length 46
16:01:24.536502 00:50:56:c0:00:08 > ff:ff:ff:ff:ff:ff, ethertype ARP (0x0806), length 60: Request who-has 192.168.85.2 tell 192.168.85.1, length 46
16:01:25.537357 00:50:56:c0:00:08 > ff:ff:ff:ff:ff:ff, ethertype ARP (0x0806), length 60: Request who-has 192.168.85.2 tell 192.168.85.1, length 46
16:01:26.800663 00:50:56:c0:00:08 > ff:ff:ff:ff:ff:ff, ethertype ARP (0x0806), length 60: Request who-has 192.168.85.2 tell 192.168.85.1, length 46
16:01:27.534414 00:50:56:c0:00:08 > ff:ff:ff:ff:ff:ff, ethertype ARP (0x0806), length 60: Request who-has 192.168.85.2 tell 192.168.85.1, length 46
16:01:28.534277 00:50:56:c0:00:08 > ff:ff:ff:ff:ff:ff, ethertype ARP (0x0806), length 60: Request who-has 192.168.85.2 tell 192.168.85.1, length 46
16:01:32.831727 00:50:56:c0:00:08 > ff:ff:ff:ff:ff:ff, ethertype ARP (0x0806), length 60: Request who-has 192.168.85.2 tell 192.168.85.1, length 46
16:01:33.531749 00:50:56:c0:00:08 > ff:ff:ff:ff:ff:ff, ethertype ARP (0x0806), length 60: Request who-has 192.168.85.2 tell 192.168.85.1, length 46
16:01:34.534668 00:50:56:c0:00:08 > ff:ff:ff:ff:ff:ff, ethertype ARP (0x0806), length 60: Request who-has 192.168.85.2 tell 192.168.85.1, length 46
16:01:35.861047 00:50:56:c0:00:08 > ff:ff:ff:ff:ff:ff, ethertype ARP (0x0806), length 60: Request who-has 192.168.85.2 tell 192.168.85.1, length 46
16:01:36.546759 00:50:56:c0:00:08 > ff:ff:ff:ff:ff:ff, ethertype ARP (0x0806), length 60: Request who-has 192.168.85.2 tell 192.168.85.1, length 46
16:01:37.540360 00:50:56:c0:00:08 > ff:ff:ff:ff:ff:ff, ethertype ARP (0x0806), length 60: Request who-has 192.168.85.2 tell 192.168.85.1, length 46
16:02:05.713938 00:50:56:c0:00:08 > 01:00:5e:7f:ff:fa, ethertype IPv4 (0x0800), length 217: 192.168.85.1.64697 > 239.255.255.250.1900: UDP, length 175
16:02:06.717200 00:50:56:c0:00:08 > 01:00:5e:7f:ff:fa, ethertype IPv4 (0x0800), length 217: 192.168.85.1.64697 > 239.255.255.250.1900: UDP, length 175
16:02:07.726277 00:50:56:c0:00:08 > 01:00:5e:7f:ff:fa, ethertype IPv4 (0x0800), length 217: 192.168.85.1.64697 > 239.255.255.250.1900: UDP, length 175
16:02:08.735869 00:50:56:c0:00:08 > 01:00:5e:7f:ff:fa, ethertype IPv4 (0x0800), length 217: 192.168.85.1.64697 > 239.255.255.250.1900: UDP, length 175
16:02:37.846330 00:50:56:ef:62:54 > 00:0c:29:9d:69:42, ethertype IPv4 (0x0800), length 78: 34.107.243.93.443 > 192.168.85.129.47842: Flags [P.], seq 1625582468:1625582492, ack 2548648210, win 64240, length 24
16:02:37.847517 00:0c:29:9d:69:42 > 00:50:56:ef:62:54, ethertype IPv4 (0x0800), length 82: 192.168.85.129.47842 > 34.107.243.93.443: Flags [P.], seq 1:29, ack 24, win 62780, length 28
16:02:37.847991 00:50:56:ef:62:54 > 00:0c:29:9d:69:42, ethertype IPv4 (0x0800), length 60: 34.107.243.93.443 > 192.168.85.129.47842: Flags [.], ack 29, win 64240, length 0
16:02:38.783613 00:0c:29:9d:69:42 > 00:50:56:ef:62:54, ethertype IPv4 (0x0800), length 88: 192.168.85.129.57216 > 192.168.85.2.53: 45759+ A? contile.services.mozilla.com. (46)
16:02:38.784062 00:0c:29:9d:69:42 > 00:50:56:ef:62:54, ethertype IPv4 (0x0800), length 88: 192.168.85.129.54334 > 192.168.85.2.53: 11355+ AAAA? contile.services.mozilla.com. (46)
16:02:38.793709 00:50:56:ef:62:54 > 00:0c:29:9d:69:42, ethertype IPv4 (0x0800), length 169: 192.168.85.2.53 > 192.168.85.129.54334: 11355 0/1/0 (127)
16:02:38.793711 00:50:56:ef:62:54 > 00:0c:29:9d:69:42, ethertype IPv4 (0x0800), length 417: 192.168.85.2.53 > 192.168.85.129.57216: 45759 1/4/8 A 34.117.188.166 (375)
16:02:38.800967 00:0c:29:9d:69:42 > 00:50:56:ef:62:54, ethertype IPv4 (0x0800), length 1399: 192.168.85.129.34334 > 34.117.188.166.443: UDP, length 1357
16:02:38.849866 00:50:56:ef:62:54 > 00:0c:29:9d:69:42, ethertype IPv4 (0x0800), length 1399: 34.117.188.166.443 > 192.168.85.129.34334: UDP, length 1357
16:02:38.886502 00:0c:29:9d:69:42 > 00:50:56:ef:62:54, ethertype IPv4 (0x0800), length 74: 192.168.85.129.41032 > 34.117.188.166.443: Flags [S], seq 2755273553, win 64240, options [mss 1460,sackOK,TS val 2624640142 ecr 0,nop,wscale 7], length 0
16:02:38.895887 00:50:56:ef:62:54 > 00:0c:29:9d:69:42, ethertype IPv4 (0x0800), length 1399: 34.117.188.166.443 > 192.168.85.129.34334: UDP, length 1357
16:02:38.897359 00:50:56:ef:62:54 > 00:0c:29:9d:69:42, ethertype IPv4 (0x0800), length 1399: 34.117.188.166.443 > 192.168.85.129.34334: UDP, length 1357
16:02:38.897360 00:50:56:ef:62:54 > 00:0c:29:9d:69:42, ethertype IPv4 (0x0800), length 718: 34.117.188.166.443 > 192.168.85.129.34334: UDP, length 676
16:02:38.901451 00:0c:29:9d:69:42 > 00:50:56:ef:62:54, ethertype IPv4 (0x0800), length 85: 192.168.85.129.34334 > 34.117.188.166.443: UDP, length 43
16:02:38.911859 00:0c:29:9d:69:42 > 00:50:56:ef:62:54, ethertype IPv4 (0x0800), length 173: 192.168.85.129.34334 > 34.117.188.166.443: UDP, length 131
16:02:38.912770 00:0c:29:9d:69:42 > 00:50:56:ef:62:54, ethertype IPv4 (0x0800), length 114: 192.168.85.129.34334 > 34.117.188.166.443: UDP, length 72
16:02:38.913581 00:0c:29:9d:69:42 > 00:50:56:ef:62:54, ethertype IPv4 (0x0800), length 224: 192.168.85.129.34334 > 34.117.188.166.443: UDP, length 182
16:02:38.940774 00:50:56:ef:62:54 > 00:0c:29:9d:69:42, ethertype IPv4 (0x0800), length 614: 34.117.188.166.443 > 192.168.85.129.34334: UDP, length 572
16:02:38.940775 00:50:56:ef:62:54 > 00:0c:29:9d:69:42, ethertype IPv4 (0x0800), length 165: 34.117.188.166.443 > 192.168.85.129.34334: UDP, length 123
16:02:38.940776 00:50:56:ef:62:54 > 00:0c:29:9d:69:42, ethertype IPv4 (0x0800), length 68: 34.117.188.166.443 > 192.168.85.129.34334: UDP, length 26
16:02:38.943441 00:0c:29:9d:69:42 > 00:50:56:ef:62:54, ethertype IPv4 (0x0800), length 73: 192.168.85.129.34334 > 34.117.188.166.443: UDP, length 31
16:02:38.962568 00:50:56:ef:62:54 > 00:0c:29:9d:69:42, ethertype IPv4 (0x0800), length 73: 34.117.188.166.443 > 192.168.85.129.34334: UDP, length 31
16:02:38.983033 00:0c:29:9d:69:42 > 00:50:56:ef:62:54, ethertype IPv4 (0x0800), length 74: 192.168.85.129.34334 > 34.117.188.166.443: UDP, length 32
16:02:39.137229 00:0c:29:9d:69:42 > 00:50:56:ef:62:54, ethertype IPv4 (0x0800), length 74: 192.168.85.129.41040 > 34.117.188.166.443: Flags [S], seq 1414728329, win 64240, options [mss 1460,sackOK,TS val 2624640392 ecr 0,nop,wscale 7], length 0
16:02:39.160669 00:50:56:ef:62:54 > 00:0c:29:9d:69:42, ethertype IPv4 (0x0800), length 60: 34.117.188.166.443 > 192.168.85.129.41040: Flags [S.], seq 1022171918, ack 1414728330, win 64240, options [mss 1460], length 0
16:02:39.160786 00:0c:29:9d:69:42 > 00:50:56:ef:62:54, ethertype IPv4 (0x0800), length 54: 192.168.85.129.41040 > 34.117.188.166.443: Flags [.], ack 1, win 64240, length 0
16:02:39.162970 00:0c:29:9d:69:42 > 00:50:56:ef:62:54, ethertype IPv4 (0x0800), length 1306: 192.168.85.129.41040 > 34.117.188.166.443: Flags [P.], seq 1:1253, ack 1, win 64240, length 1252
16:02:39.163726 00:50:56:ef:62:54 > 00:0c:29:9d:69:42, ethertype IPv4 (0x0800), length 60: 34.117.188.166.443 > 192.168.85.129.41040: Flags [.], ack 1253, win 64240, length 0
16:02:39.163727 00:50:56:ef:62:54 > 00:0c:29:9d:69:42, ethertype IPv4 (0x0800), length 1395: 34.117.188.166.443 > 192.168.85.129.34334: UDP, length 1353
16:02:39.163728 00:50:56:ef:62:54 > 00:0c:29:9d:69:42, ethertype IPv4 (0x0800), length 162: 34.117.188.166.443 > 192.168.85.129.34334: UDP, length 120
16:02:39.164705 00:0c:29:9d:69:42 > 00:50:56:ef:62:54, ethertype IPv4 (0x0800), length 78: 192.168.85.129.34334 > 34.117.188.166.443: UDP, length 36
16:02:39.213916 00:50:56:ef:62:54 > 00:0c:29:9d:69:42, ethertype IPv4 (0x0800), length 69: 34.117.188.166.443 > 192.168.85.129.34334: UDP, length 27
16:02:39.239828 00:50:56:ef:62:54 > 00:0c:29:9d:69:42, ethertype IPv4 (0x0800), length 60: 34.117.188.166.443 > 192.168.85.129.41032: Flags [S.], seq 2050850233, ack 2755273554, win 64240, options [mss 1460], length 0
16:02:39.239945 00:0c:29:9d:69:42 > 00:50:56:ef:62:54, ethertype IPv4 (0x0800), length 54: 192.168.85.129.41032 > 34.117.188.166.443: Flags [.], ack 1, win 64240, length 0
16:02:39.242133 00:0c:29:9d:69:42 > 00:50:56:ef:62:54, ethertype IPv4 (0x0800), length 1306: 192.168.85.129.41032 > 34.117.188.166.443: Flags [P.], seq 1:1253, ack 1, win 64240, length 1252
16:02:39.243101 00:50:56:ef:62:54 > 00:0c:29:9d:69:42, ethertype IPv4 (0x0800), length 60: 34.117.188.166.443 > 192.168.85.129.41032: Flags [.], ack 1253, win 64240, length 0
16:02:39.251821 00:50:56:ef:62:54 > 00:0c:29:9d:69:42, ethertype IPv4 (0x0800), length 3136: 34.117.188.166.443 > 192.168.85.129.41040: Flags [P.], seq 1:3083, ack 1253, win 64240, length 3082
16:02:39.251907 00:0c:29:9d:69:42 > 00:50:56:ef:62:54, ethertype IPv4 (0x0800), length 54: 192.168.85.129.41040 > 34.117.188.166.443: Flags [.], ack 3083, win 62780, length 0
16:02:39.260618 00:0c:29:9d:69:42 > 00:50:56:ef:62:54, ethertype IPv4 (0x0800), length 118: 192.168.85.129.41040 > 34.117.188.166.443: Flags [P.], seq 1253:1317, ack 3083, win 62780, length 64
16:02:39.261197 00:50:56:ef:62:54 > 00:0c:29:9d:69:42, ethertype IPv4 (0x0800), length 60: 34.117.188.166.443 > 192.168.85.129.41040: Flags [.], ack 1317, win 64240, length 0
16:02:39.263083 00:0c:29:9d:69:42 > 00:50:56:ef:62:54, ethertype IPv4 (0x0800), length 224: 192.168.85.129.41040 > 34.117.188.166.443: Flags [P.], seq 1317:1487, ack 3083, win 62780, length 170
16:02:39.264305 00:50:56:ef:62:54 > 00:0c:29:9d:69:42, ethertype IPv4 (0x0800), length 60: 34.117.188.166.443 > 192.168.85.129.41040: Flags [.], ack 1487, win 64240, length 0
16:02:39.282748 00:50:56:ef:62:54 > 00:0c:29:9d:69:42, ethertype IPv4 (0x0800), length 640: 34.117.188.166.443 > 192.168.85.129.41040: Flags [P.], seq 3083:3669, ack 1487, win 64240, length 586
16:02:39.283789 00:0c:29:9d:69:42 > 00:50:56:ef:62:54, ethertype IPv4 (0x0800), length 85: 192.168.85.129.41040 > 34.117.188.166.443: Flags [P.], seq 1487:1518, ack 3669, win 62780, length 31
16:02:39.284302 00:50:56:ef:62:54 > 00:0c:29:9d:69:42, ethertype IPv4 (0x0800), length 60: 34.117.188.166.443 > 192.168.85.129.41040: Flags [.], ack 1518, win 64240, length 0
16:02:39.303575 00:50:56:ef:62:54 > 00:0c:29:9d:69:42, ethertype IPv4 (0x0800), length 85: 34.117.188.166.443 > 192.168.85.129.41040: Flags [P.], seq 3669:3700, ack 1518, win 64240, length 31
16:02:39.344724 00:0c:29:9d:69:42 > 00:50:56:ef:62:54, ethertype IPv4 (0x0800), length 54: 192.168.85.129.41040 > 34.117.188.166.443: Flags [.], ack 3700, win 62780, length 0
16:02:39.359469 00:50:56:ef:62:54 > 00:0c:29:9d:69:42, ethertype IPv4 (0x0800), length 266: 34.117.188.166.443 > 192.168.85.129.41032: Flags [P.], seq 1:213, ack 1253, win 64240, length 212
16:02:39.359573 00:0c:29:9d:69:42 > 00:50:56:ef:62:54, ethertype IPv4 (0x0800), length 54: 192.168.85.129.41032 > 34.117.188.166.443: Flags [.], ack 213, win 64028, length 0
16:02:39.360647 00:0c:29:9d:69:42 > 00:50:56:ef:62:54, ethertype IPv4 (0x0800), length 118: 192.168.85.129.41032 > 34.117.188.166.443: Flags [P.], seq 1253:1317, ack 213, win 64028, length 64
16:02:39.361349 00:50:56:ef:62:54 > 00:0c:29:9d:69:42, ethertype IPv4 (0x0800), length 60: 34.117.188.166.443 > 192.168.85.129.41032: Flags [.], ack 1317, win 64240, length 0
16:02:39.361472 00:0c:29:9d:69:42 > 00:50:56:ef:62:54, ethertype IPv4 (0x0800), length 241: 192.168.85.129.41032 > 34.117.188.166.443: Flags [P.], seq 1317:1504, ack 213, win 64028, length 187
16:02:39.361825 00:50:56:ef:62:54 > 00:0c:29:9d:69:42, ethertype IPv4 (0x0800), length 60: 34.117.188.166.443 > 192.168.85.129.41032: Flags [.], ack 1504, win 64240, length 0
16:02:39.405572 00:50:56:ef:62:54 > 00:0c:29:9d:69:42, ethertype IPv4 (0x0800), length 672: 34.117.188.166.443 > 192.168.85.129.41032: Flags [P.], seq 213:831, ack 1504, win 64240, length 618
16:02:39.406858 00:0c:29:9d:69:42 > 00:50:56:ef:62:54, ethertype IPv4 (0x0800), length 78: 192.168.85.129.41032 > 34.117.188.166.443: Flags [P.], seq 1504:1528, ack 831, win 64028, length 24
16:02:39.407061 00:0c:29:9d:69:42 > 00:50:56:ef:62:54, ethertype IPv4 (0x0800), length 54: 192.168.85.129.41032 > 34.117.188.166.443: Flags [F.], seq 1528, ack 831, win 64028, length 0
16:02:39.407534 00:50:56:ef:62:54 > 00:0c:29:9d:69:42, ethertype IPv4 (0x0800), length 60: 34.117.188.166.443 > 192.168.85.129.41032: Flags [.], ack 1528, win 64240, length 0
16:02:39.407731 00:50:56:ef:62:54 > 00:0c:29:9d:69:42, ethertype IPv4 (0x0800), length 60: 34.117.188.166.443 > 192.168.85.129.41032: Flags [.], ack 1529, win 64239, length 0
16:02:39.900354 00:50:56:ef:62:54 > 00:0c:29:9d:69:42, ethertype IPv4 (0x0800), length 85: 34.117.188.166.443 > 192.168.85.129.41032: Flags [FP.], seq 831:862, ack 1529, win 64239, length 31
16:02:39.900397 00:0c:29:9d:69:42 > 00:50:56:ef:62:54, ethertype IPv4 (0x0800), length 54: 192.168.85.129.41032 > 34.117.188.166.443: Flags [R], seq 2755275082, win 0, length 0
16:03:15.044679 00:50:56:c0:00:08 > ff:ff:ff:ff:ff:ff, ethertype ARP (0x0806), length 60: Request who-has 192.168.85.2 tell 192.168.85.1, length 46
16:03:16.259900 00:50:56:c0:00:08 > ff:ff:ff:ff:ff:ff, ethertype ARP (0x0806), length 60: Request who-has 192.168.85.2 tell 192.168.85.1, length 46
16:03:17.051071 00:50:56:c0:00:08 > ff:ff:ff:ff:ff:ff, ethertype ARP (0x0806), length 60: Request who-has 192.168.85.2 tell 192.168.85.1, length 46
16:03:18.052851 00:50:56:c0:00:08 > ff:ff:ff:ff:ff:ff, ethertype ARP (0x0806), length 60: Request who-has 192.168.85.2 tell 192.168.85.1, length 46
16:03:23.824367 00:50:56:c0:00:08 > ff:ff:ff:ff:ff:ff, ethertype ARP (0x0806), length 60: Request who-has 192.168.85.2 tell 192.168.85.1, length 46
16:03:24.555166 00:50:56:c0:00:08 > ff:ff:ff:ff:ff:ff, ethertype ARP (0x0806), length 60: Request who-has 192.168.85.2 tell 192.168.85.1, length 46
16:03:25.543936 00:50:56:c0:00:08 > ff:ff:ff:ff:ff:ff, ethertype ARP (0x0806), length 60: Request who-has 192.168.85.2 tell 192.168.85.1, length 46
16:03:26.843781 00:50:56:c0:00:08 > ff:ff:ff:ff:ff:ff, ethertype ARP (0x0806), length 60: Request who-has 192.168.85.2 tell 192.168.85.1, length 46
16:03:27.548348 00:50:56:c0:00:08 > ff:ff:ff:ff:ff:ff, ethertype ARP (0x0806), length 60: Request who-has 192.168.85.2 tell 192.168.85.1, length 46
16:03:28.547062 00:50:56:c0:00:08 > ff:ff:ff:ff:ff:ff, ethertype ARP (0x0806), length 60: Request who-has 192.168.85.2 tell 192.168.85.1, length 46
16:03:32.901364 00:50:56:c0:00:08 > ff:ff:ff:ff:ff:ff, ethertype ARP (0x0806), length 60: Request who-has 192.168.85.2 tell 192.168.85.1, length 46
16:03:33.553894 00:50:56:c0:00:08 > ff:ff:ff:ff:ff:ff, ethertype ARP (0x0806), length 60: Request who-has 192.168.85.2 tell 192.168.85.1, length 46
16:03:34.548345 00:50:56:c0:00:08 > ff:ff:ff:ff:ff:ff, ethertype ARP (0x0806), length 60: Request who-has 192.168.85.2 tell 192.168.85.1, length 46
16:03:35.909554 00:50:56:c0:00:08 > ff:ff:ff:ff:ff:ff, ethertype ARP (0x0806), length 60: Request who-has 192.168.85.2 tell 192.168.85.1, length 46
16:03:36.547602 00:50:56:c0:00:08 > ff:ff:ff:ff:ff:ff, ethertype ARP (0x0806), length 60: Request who-has 192.168.85.2 tell 192.168.85.1, length 46
16:03:37.544440 00:50:56:c0:00:08 > ff:ff:ff:ff:ff:ff, ethertype ARP (0x0806), length 60: Request who-has 192.168.85.2 tell 192.168.85.1, length 46
16:03:39.705773 00:0c:29:9d:69:42 > 00:50:56:ef:62:54, ethertype IPv4 (0x0800), length 93: 192.168.85.129.41040 > 34.117.188.166.443: Flags [P.], seq 1518:1557, ack 3700, win 62780, length 39
16:03:39.707044 00:50:56:ef:62:54 > 00:0c:29:9d:69:42, ethertype IPv4 (0x0800), length 60: 34.117.188.166.443 > 192.168.85.129.41040: Flags [.], ack 1557, win 64240, length 0
16:03:39.724531 00:50:56:ef:62:54 > 00:0c:29:9d:69:42, ethertype IPv4 (0x0800), length 93: 34.117.188.166.443 > 192.168.85.129.41040: Flags [P.], seq 3700:3739, ack 1557, win 64240, length 39
16:03:39.724644 00:0c:29:9d:69:42 > 00:50:56:ef:62:54, ethertype IPv4 (0x0800), length 54: 192.168.85.129.41040 > 34.117.188.166.443: Flags [.], ack 3739, win 62780, length 0
16:03:44.948513 00:0c:29:9d:69:42 > 00:50:56:ef:62:54, ethertype ARP (0x0806), length 42: Request who-has 192.168.85.2 tell 192.168.85.129, length 28
16:03:44.948936 00:50:56:ef:62:54 > 00:0c:29:9d:69:42, ethertype ARP (0x0806), length 60: Reply 192.168.85.2 is-at 00:50:56:ef:62:54, length 46
16:04:05.738341 00:50:56:c0:00:08 > 01:00:5e:7f:ff:fa, ethertype IPv4 (0x0800), length 217: 192.168.85.1.56133 > 239.255.255.250.1900: UDP, length 175
16:04:06.743219 00:50:56:c0:00:08 > 01:00:5e:7f:ff:fa, ethertype IPv4 (0x0800), length 217: 192.168.85.1.56133 > 239.255.255.250.1900: UDP, length 175
16:04:07.755923 00:50:56:c0:00:08 > 01:00:5e:7f:ff:fa, ethertype IPv4 (0x0800), length 217: 192.168.85.1.56133 > 239.255.255.250.1900: UDP, length 175
16:04:08.771616 00:50:56:c0:00:08 > 01:00:5e:7f:ff:fa, ethertype IPv4 (0x0800), length 217: 192.168.85.1.56133 > 239.255.255.250.1900: UDP, length 175
16:04:38.707509 00:0c:29:9d:69:42 > 00:50:56:ef:62:54, ethertype IPv4 (0x0800), length 93: 192.168.85.129.41040 > 34.117.188.166.443: Flags [P.], seq 1557:1596, ack 3739, win 62780, length 39
16:04:38.708449 00:50:56:ef:62:54 > 00:0c:29:9d:69:42, ethertype IPv4 (0x0800), length 60: 34.117.188.166.443 > 192.168.85.129.41040: Flags [.], ack 1596, win 64240, length 0
16:04:38.729102 00:50:56:ef:62:54 > 00:0c:29:9d:69:42, ethertype IPv4 (0x0800), length 93: 34.117.188.166.443 > 192.168.85.129.41040: Flags [P.], seq 3739:3778, ack 1596, win 64240, length 39
16:04:38.729202 00:0c:29:9d:69:42 > 00:50:56:ef:62:54, ethertype IPv4 (0x0800), length 54: 192.168.85.129.41040 > 34.117.188.166.443: Flags [.], ack 3778, win 62780, length 0
16:04:43.828728 00:0c:29:9d:69:42 > 00:50:56:ef:62:54, ethertype ARP (0x0806), length 42: Request who-has 192.168.85.2 tell 192.168.85.129, length 28
16:04:43.829298 00:50:56:ef:62:54 > 00:0c:29:9d:69:42, ethertype ARP (0x0806), length 60: Reply 192.168.85.2 is-at 00:50:56:ef:62:54, length 46
16:04:47.922444 00:0c:29:9d:69:42 > 00:50:56:ef:62:54, ethertype IPv4 (0x0800), length 89: 192.168.85.129.38185 > 192.168.85.2.53: 25683+ AAAA? connectivity-check.ubuntu.com. (47)
16:04:47.928813 00:50:56:ef:62:54 > 00:0c:29:9d:69:42, ethertype IPv4 (0x0800), length 537: 192.168.85.2.53 > 192.168.85.129.38185: 25683 12/3/3 AAAA 2620:2d:4002:1::198, AAAA 2001:67c:1562::23, AAAA 2620:2d:4000:1::97, AAAA 2620:2d:4002:1::196, AAAA 2620:2d:4000:1::96, AAAA 2620:2d:4000:1::22, AAAA 2620:2d:4002:1::197, AAAA 2620:2d:4000:1::23, AAAA 2620:2d:4000:1::98, AAAA 2001:67c:1562::24, AAAA 2620:2d:4000:1::2b, AAAA 2620:2d:4000:1::2a (495)
16:05:15.053935 00:50:56:c0:00:08 > ff:ff:ff:ff:ff:ff, ethertype ARP (0x0806), length 60: Request who-has 192.168.85.2 tell 192.168.85.1, length 46
16:05:16.259049 00:50:56:c0:00:08 > ff:ff:ff:ff:ff:ff, ethertype ARP (0x0806), length 60: Request who-has 192.168.85.2 tell 192.168.85.1, length 46
16:05:17.053583 00:50:56:c0:00:08 > ff:ff:ff:ff:ff:ff, ethertype ARP (0x0806), length 60: Request who-has 192.168.85.2 tell 192.168.85.1, length 46
16:05:18.053054 00:50:56:c0:00:08 > ff:ff:ff:ff:ff:ff, ethertype ARP (0x0806), length 60: Request who-has 192.168.85.2 tell 192.168.85.1, length 46
16:05:23.812826 00:50:56:c0:00:08 > ff:ff:ff:ff:ff:ff, ethertype ARP (0x0806), length 60: Request who-has 192.168.85.2 tell 192.168.85.1, length 46
16:05:24.559158 00:50:56:c0:00:08 > ff:ff:ff:ff:ff:ff, ethertype ARP (0x0806), length 60: Request who-has 192.168.85.2 tell 192.168.85.1, length 46
16:05:25.558514 00:50:56:c0:00:08 > ff:ff:ff:ff:ff:ff, ethertype ARP (0x0806), length 60: Request who-has 192.168.85.2 tell 192.168.85.1, length 46
16:05:26.837796 00:50:56:c0:00:08 > ff:ff:ff:ff:ff:ff, ethertype ARP (0x0806), length 60: Request who-has 192.168.85.2 tell 192.168.85.1, length 46
16:05:27.551359 00:50:56:c0:00:08 > ff:ff:ff:ff:ff:ff, ethertype ARP (0x0806), length 60: Request who-has 192.168.85.2 tell 192.168.85.1, length 46
16:05:28.560086 00:50:56:c0:00:08 > ff:ff:ff:ff:ff:ff, ethertype ARP (0x0806), length 60: Request who-has 192.168.85.2 tell 192.168.85.1, length 46
16:05:29.729439 00:0c:29:9d:69:42 > 00:50:56:ef:62:54, ethertype IPv4 (0x0800), length 93: 192.168.85.129.41040 > 34.117.188.166.443: Flags [P.], seq 1596:1635, ack 3778, win 62780, length 39
16:05:29.729750 00:0c:29:9d:69:42 > 00:50:56:ef:62:54, ethertype IPv4 (0x0800), length 78: 192.168.85.129.41040 > 34.117.188.166.443: Flags [P.], seq 1635:1659, ack 3778, win 62780, length 24
16:05:29.729817 00:0c:29:9d:69:42 > 00:50:56:ef:62:54, ethertype IPv4 (0x0800), length 54: 192.168.85.129.41040 > 34.117.188.166.443: Flags [F.], seq 1659, ack 3778, win 62780, length 0
16:05:29.729918 00:50:56:ef:62:54 > 00:0c:29:9d:69:42, ethertype IPv4 (0x0800), length 60: 34.117.188.166.443 > 192.168.85.129.41040: Flags [.], ack 1635, win 64240, length 0
16:05:29.729918 00:50:56:ef:62:54 > 00:0c:29:9d:69:42, ethertype IPv4 (0x0800), length 60: 34.117.188.166.443 > 192.168.85.129.41040: Flags [.], ack 1659, win 64240, length 0
16:05:29.730008 00:50:56:ef:62:54 > 00:0c:29:9d:69:42, ethertype IPv4 (0x0800), length 60: 34.117.188.166.443 > 192.168.85.129.41040: Flags [.], ack 1660, win 64239, length 0
16:05:29.750176 00:50:56:ef:62:54 > 00:0c:29:9d:69:42, ethertype IPv4 (0x0800), length 60: 34.117.188.166.443 > 192.168.85.129.41040: Flags [FP.], seq 3778, ack 1660, win 64239, length 0
16:05:29.750215 00:0c:29:9d:69:42 > 00:50:56:ef:62:54, ethertype IPv4 (0x0800), length 54: 192.168.85.129.41040 > 34.117.188.166.443: Flags [.], ack 3779, win 62780, length 0
16:05:32.865114 00:50:56:c0:00:08 > ff:ff:ff:ff:ff:ff, ethertype ARP (0x0806), length 60: Request who-has 192.168.85.2 tell 192.168.85.1, length 46
16:05:33.550209 00:50:56:c0:00:08 > ff:ff:ff:ff:ff:ff, ethertype ARP (0x0806), length 60: Request who-has 192.168.85.2 tell 192.168.85.1, length 46
16:05:34.547392 00:50:56:c0:00:08 > ff:ff:ff:ff:ff:ff, ethertype ARP (0x0806), length 60: Request who-has 192.168.85.2 tell 192.168.85.1, length 46
16:05:34.772646 00:0c:29:9d:69:42 > 00:50:56:ef:62:54, ethertype ARP (0x0806), length 42: Request who-has 192.168.85.2 tell 192.168.85.129, length 28
16:05:34.773071 00:50:56:ef:62:54 > 00:0c:29:9d:69:42, ethertype ARP (0x0806), length 60: Reply 192.168.85.2 is-at 00:50:56:ef:62:54, length 46
16:05:35.887211 00:50:56:c0:00:08 > ff:ff:ff:ff:ff:ff, ethertype ARP (0x0806), length 60: Request who-has 192.168.85.2 tell 192.168.85.1, length 46
16:05:36.554544 00:50:56:c0:00:08 > ff:ff:ff:ff:ff:ff, ethertype ARP (0x0806), length 60: Request who-has 192.168.85.2 tell 192.168.85.1, length 46
16:05:37.551192 00:50:56:c0:00:08 > ff:ff:ff:ff:ff:ff, ethertype ARP (0x0806), length 60: Request who-has 192.168.85.2 tell 192.168.85.1, length 46
16:06:05.758961 00:50:56:c0:00:08 > 01:00:5e:7f:ff:fa, ethertype IPv4 (0x0800), length 217: 192.168.85.1.60220 > 239.255.255.250.1900: UDP, length 175
16:06:06.764679 00:50:56:c0:00:08 > 01:00:5e:7f:ff:fa, ethertype IPv4 (0x0800), length 217: 192.168.85.1.60220 > 239.255.255.250.1900: UDP, length 175
16:06:07.779084 00:50:56:c0:00:08 > 01:00:5e:7f:ff:fa, ethertype IPv4 (0x0800), length 217: 192.168.85.1.60220 > 239.255.255.250.1900: UDP, length 175
16:06:08.792786 00:50:56:c0:00:08 > 01:00:5e:7f:ff:fa, ethertype IPv4 (0x0800), length 217: 192.168.85.1.60220 > 239.255.255.250.1900: UDP, length 175
16:06:17.022326 00:0c:29:9d:69:42 > 00:50:56:ef:62:54, ethertype IPv4 (0x0800), length 106: 192.168.85.129.41657 > 192.168.85.2.53: 12715+ A? tiles-cdn.prod.ads.prod.webservices.mozgcp.net. (64)
16:06:17.022898 00:0c:29:9d:69:42 > 00:50:56:ef:62:54, ethertype IPv4 (0x0800), length 106: 192.168.85.129.40092 > 192.168.85.2.53: 30681+ AAAA? tiles-cdn.prod.ads.prod.webservices.mozgcp.net. (64)
16:06:17.027038 00:50:56:ef:62:54 > 00:0c:29:9d:69:42, ethertype IPv4 (0x0800), length 419: 192.168.85.2.53 > 192.168.85.129.41657: 12715 1/4/8 A 34.36.165.17 (377)
16:06:17.027039 00:50:56:ef:62:54 > 00:0c:29:9d:69:42, ethertype IPv4 (0x0800), length 431: 192.168.85.2.53 > 192.168.85.129.40092: 30681 1/4/8 AAAA 2600:1901:0:8e3f:: (389)
16:06:17.028165 00:0c:29:9d:69:42 > 00:50:56:ef:62:54, ethertype IPv4 (0x0800), length 74: 192.168.85.129.33204 > 34.36.165.17.443: Flags [S], seq 133433255, win 64240, options [mss 1460,sackOK,TS val 1136813094 ecr 0,nop,wscale 7], length 0
16:06:17.047374 00:50:56:ef:62:54 > 00:0c:29:9d:69:42, ethertype IPv4 (0x0800), length 60: 34.36.165.17.443 > 192.168.85.129.33204: Flags [S.], seq 56950882, ack 133433256, win 64240, options [mss 1460], length 0
16:06:17.047455 00:0c:29:9d:69:42 > 00:50:56:ef:62:54, ethertype IPv4 (0x0800), length 54: 192.168.85.129.33204 > 34.36.165.17.443: Flags [.], ack 1, win 64240, length 0
16:06:17.049093 00:0c:29:9d:69:42 > 00:50:56:ef:62:54, ethertype IPv4 (0x0800), length 1308: 192.168.85.129.33204 > 34.36.165.17.443: Flags [P.], seq 1:1255, ack 1, win 64240, length 1254
16:06:17.049606 00:50:56:ef:62:54 > 00:0c:29:9d:69:42, ethertype IPv4 (0x0800), length 60: 34.36.165.17.443 > 192.168.85.129.33204: Flags [.], ack 1255, win 64240, length 0
16:06:17.081769 00:0c:29:9d:69:42 > 00:50:56:ef:62:54, ethertype IPv4 (0x0800), length 90: 192.168.85.129.35440 > 192.168.85.2.53: 9713+ A? incoming.telemetry.mozilla.org. (48)
16:06:17.081927 00:0c:29:9d:69:42 > 00:50:56:ef:62:54, ethertype IPv4 (0x0800), length 90: 192.168.85.129.36581 > 192.168.85.2.53: 32614+ AAAA? incoming.telemetry.mozilla.org. (48)
16:06:17.084669 00:50:56:ef:62:54 > 00:0c:29:9d:69:42, ethertype IPv4 (0x0800), length 475: 192.168.85.2.53 > 192.168.85.129.35440: 9713 2/4/8 CNAME telemetry-incoming.r53-2.services.mozilla.com., A 34.120.208.123 (433)
16:06:17.084670 00:50:56:ef:62:54 > 00:0c:29:9d:69:42, ethertype IPv4 (0x0800), length 228: 192.168.85.2.53 > 192.168.85.129.36581: 32614 1/1/0 CNAME telemetry-incoming.r53-2.services.mozilla.com. (186)
16:06:17.085381 00:0c:29:9d:69:42 > 00:50:56:ef:62:54, ethertype IPv4 (0x0800), length 105: 192.168.85.129.54390 > 192.168.85.2.53: 20006+ AAAA? telemetry-incoming.r53-2.services.mozilla.com. (63)
16:06:17.085717 00:0c:29:9d:69:42 > 00:50:56:ef:62:54, ethertype IPv4 (0x0800), length 74: 192.168.85.129.43206 > 34.120.208.123.443: Flags [S], seq 4221443949, win 64240, options [mss 1460,sackOK,TS val 4162564519 ecr 0,nop,wscale 7], length 0
16:06:17.089302 00:50:56:ef:62:54 > 00:0c:29:9d:69:42, ethertype IPv4 (0x0800), length 187: 192.168.85.2.53 > 192.168.85.129.54390: 20006 0/1/0 (145)
16:06:17.106907 00:0c:29:9d:69:42 > 00:50:56:ef:62:54, ethertype IPv4 (0x0800), length 89: 192.168.85.129.37442 > 192.168.85.2.53: 63813+ A? img-getpocket.cdn.mozilla.net. (47)
16:06:17.107088 00:0c:29:9d:69:42 > 00:50:56:ef:62:54, ethertype IPv4 (0x0800), length 89: 192.168.85.129.49456 > 192.168.85.2.53: 54579+ AAAA? img-getpocket.cdn.mozilla.net. (47)
16:06:17.111039 00:50:56:ef:62:54 > 00:0c:29:9d:69:42, ethertype IPv4 (0x0800), length 497: 192.168.85.2.53 > 192.168.85.129.37442: 63813 3/4/8 CNAME img-getpocket-cdn.prod.mozaws.net., CNAME img-prod.pocket.prod.cloudops.mozgcp.net., A 34.120.237.76 (455)
16:06:17.111039 00:50:56:ef:62:54 > 00:0c:29:9d:69:42, ethertype IPv4 (0x0800), length 509: 192.168.85.2.53 > 192.168.85.129.49456: 54579 3/4/8 CNAME img-getpocket-cdn.prod.mozaws.net., CNAME img-prod.pocket.prod.cloudops.mozgcp.net., AAAA 2600:1901:0:e988:: (467)
16:06:17.112706 00:0c:29:9d:69:42 > 00:50:56:ef:62:54, ethertype IPv4 (0x0800), length 74: 192.168.85.129.50824 > 34.120.237.76.443: Flags [S], seq 49506348, win 64240, options [mss 1460,sackOK,TS val 2547267452 ecr 0,nop,wscale 7], length 0
16:06:17.124550 00:50:56:ef:62:54 > 00:0c:29:9d:69:42, ethertype IPv4 (0x0800), length 60: 34.120.208.123.443 > 192.168.85.129.43206: Flags [S.], seq 1825713402, ack 4221443950, win 64240, options [mss 1460], length 0
16:06:17.124596 00:0c:29:9d:69:42 > 00:50:56:ef:62:54, ethertype IPv4 (0x0800), length 54: 192.168.85.129.43206 > 34.120.208.123.443: Flags [.], ack 1, win 64240, length 0
16:06:17.125938 00:0c:29:9d:69:42 > 00:50:56:ef:62:54, ethertype IPv4 (0x0800), length 1292: 192.168.85.129.43206 > 34.120.208.123.443: Flags [P.], seq 1:1239, ack 1, win 64240, length 1238
16:06:17.126499 00:50:56:ef:62:54 > 00:0c:29:9d:69:42, ethertype IPv4 (0x0800), length 60: 34.120.208.123.443 > 192.168.85.129.43206: Flags [.], ack 1239, win 64240, length 0
16:06:17.133820 00:50:56:ef:62:54 > 00:0c:29:9d:69:42, ethertype IPv4 (0x0800), length 60: 34.120.237.76.443 > 192.168.85.129.50824: Flags [S.], seq 218773614, ack 49506349, win 64240, options [mss 1460], length 0
16:06:17.133863 00:0c:29:9d:69:42 > 00:50:56:ef:62:54, ethertype IPv4 (0x0800), length 54: 192.168.85.129.50824 > 34.120.237.76.443: Flags [.], ack 1, win 64240, length 0
16:06:17.136419 00:0c:29:9d:69:42 > 00:50:56:ef:62:54, ethertype IPv4 (0x0800), length 1307: 192.168.85.129.50824 > 34.120.237.76.443: Flags [P.], seq 1:1254, ack 1, win 64240, length 1253
16:06:17.136836 00:50:56:ef:62:54 > 00:0c:29:9d:69:42, ethertype IPv4 (0x0800), length 60: 34.120.237.76.443 > 192.168.85.129.50824: Flags [.], ack 1254, win 64240, length 0
16:06:17.144528 00:50:56:ef:62:54 > 00:0c:29:9d:69:42, ethertype IPv4 (0x0800), length 3174: 34.36.165.17.443 > 192.168.85.129.33204: Flags [P.], seq 1:3121, ack 1255, win 64240, length 3120
16:06:17.144556 00:0c:29:9d:69:42 > 00:50:56:ef:62:54, ethertype IPv4 (0x0800), length 54: 192.168.85.129.33204 > 34.36.165.17.443: Flags [.], ack 3121, win 61320, length 0
16:06:17.149168 00:0c:29:9d:69:42 > 00:50:56:ef:62:54, ethertype IPv4 (0x0800), length 118: 192.168.85.129.33204 > 34.36.165.17.443: Flags [P.], seq 1255:1319, ack 3121, win 62780, length 64
16:06:17.149647 00:50:56:ef:62:54 > 00:0c:29:9d:69:42, ethertype IPv4 (0x0800), length 60: 34.36.165.17.443 > 192.168.85.129.33204: Flags [.], ack 1319, win 64240, length 0
16:06:17.149693 00:0c:29:9d:69:42 > 00:50:56:ef:62:54, ethertype IPv4 (0x0800), length 224: 192.168.85.129.33204 > 34.36.165.17.443: Flags [P.], seq 1319:1489, ack 3121, win 62780, length 170
16:06:17.150004 00:50:56:ef:62:54 > 00:0c:29:9d:69:42, ethertype IPv4 (0x0800), length 60: 34.36.165.17.443 > 192.168.85.129.33204: Flags [.], ack 1489, win 64240, length 0
16:06:17.169455 00:50:56:ef:62:54 > 00:0c:29:9d:69:42, ethertype IPv4 (0x0800), length 672: 34.36.165.17.443 > 192.168.85.129.33204: Flags [P.], seq 3121:3739, ack 1489, win 64240, length 618
16:06:17.171657 00:0c:29:9d:69:42 > 00:50:56:ef:62:54, ethertype IPv4 (0x0800), length 85: 192.168.85.129.33204 > 34.36.165.17.443: Flags [P.], seq 1489:1520, ack 3739, win 62780, length 31
16:06:17.172002 00:50:56:ef:62:54 > 00:0c:29:9d:69:42, ethertype IPv4 (0x0800), length 60: 34.36.165.17.443 > 192.168.85.129.33204: Flags [.], ack 1520, win 64240, length 0
16:06:17.186606 00:50:56:ef:62:54 > 00:0c:29:9d:69:42, ethertype IPv4 (0x0800), length 85: 34.36.165.17.443 > 192.168.85.129.33204: Flags [P.], seq 3739:3770, ack 1520, win 64240, length 31
16:06:17.224762 00:0c:29:9d:69:42 > 00:50:56:ef:62:54, ethertype IPv4 (0x0800), length 82: 192.168.85.129.58294 > 192.168.85.2.53: 12291+ A? s.click.aliexpress.com. (40)
16:06:17.225005 00:0c:29:9d:69:42 > 00:50:56:ef:62:54, ethertype IPv4 (0x0800), length 75: 192.168.85.129.38594 > 192.168.85.2.53: 42572+ A? www.youtube.com. (33)
16:06:17.225146 00:0c:29:9d:69:42 > 00:50:56:ef:62:54, ethertype IPv4 (0x0800), length 75: 192.168.85.129.47460 > 192.168.85.2.53: 52215+ AAAA? www.youtube.com. (33)
16:06:17.225275 00:0c:29:9d:69:42 > 00:50:56:ef:62:54, ethertype IPv4 (0x0800), length 76: 192.168.85.129.34193 > 192.168.85.2.53: 15482+ A? www.facebook.com. (34)
16:06:17.225745 00:0c:29:9d:69:42 > 00:50:56:ef:62:54, ethertype IPv4 (0x0800), length 76: 192.168.85.129.33383 > 192.168.85.2.53: 2748+ AAAA? www.facebook.com. (34)
16:06:17.226367 00:0c:29:9d:69:42 > 00:50:56:ef:62:54, ethertype IPv4 (0x0800), length 77: 192.168.85.129.56781 > 192.168.85.2.53: 34215+ A? www.wikipedia.org. (35)
16:06:17.226611 00:0c:29:9d:69:42 > 00:50:56:ef:62:54, ethertype IPv4 (0x0800), length 77: 192.168.85.129.59366 > 192.168.85.2.53: 11999+ AAAA? www.wikipedia.org. (35)
16:06:17.226840 00:0c:29:9d:69:42 > 00:50:56:ef:62:54, ethertype IPv4 (0x0800), length 82: 192.168.85.129.53800 > 192.168.85.2.53: 27030+ AAAA? s.click.aliexpress.com. (40)
16:06:17.227084 00:0c:29:9d:69:42 > 00:50:56:ef:62:54, ethertype IPv4 (0x0800), length 74: 192.168.85.129.60040 > 192.168.85.2.53: 6923+ A? www.amazon.com. (32)
16:06:17.227344 00:0c:29:9d:69:42 > 00:50:56:ef:62:54, ethertype IPv4 (0x0800), length 74: 192.168.85.129.52712 > 192.168.85.2.53: 4221+ AAAA? www.amazon.com. (32)
16:06:17.227672 00:0c:29:9d:69:42 > 00:50:56:ef:62:54, ethertype IPv4 (0x0800), length 73: 192.168.85.129.35716 > 192.168.85.2.53: 34759+ A? getpocket.com. (31)
16:06:17.228113 00:0c:29:9d:69:42 > 00:50:56:ef:62:54, ethertype IPv4 (0x0800), length 73: 192.168.85.129.33395 > 192.168.85.2.53: 36548+ AAAA? getpocket.com. (31)
16:06:17.228484 00:0c:29:9d:69:42 > 00:50:56:ef:62:54, ethertype IPv4 (0x0800), length 74: 192.168.85.129.42482 > 192.168.85.2.53: 50013+ A? www.reddit.com. (32)
16:06:17.228587 00:0c:29:9d:69:42 > 00:50:56:ef:62:54, ethertype IPv4 (0x0800), length 54: 192.168.85.129.33204 > 34.36.165.17.443: Flags [.], ack 3770, win 62780, length 0
16:06:17.228894 00:0c:29:9d:69:42 > 00:50:56:ef:62:54, ethertype IPv4 (0x0800), length 74: 192.168.85.129.41465 > 192.168.85.2.53: 65081+ AAAA? www.reddit.com. (32)
16:06:17.229120 00:50:56:ef:62:54 > 00:0c:29:9d:69:42, ethertype IPv4 (0x0800), length 529: 192.168.85.2.53 > 192.168.85.129.38594: 42572 17/4/5 CNAME youtube-ui.l.google.com., A 142.250.206.174, A 142.250.207.206, A 142.250.194.174, A 142.250.195.14, A 142.250.194.110, A 142.250.194.78, A 142.250.206.142, A 142.250.194.46, A 142.250.194.14, A 142.250.194.206, A 142.250.194.142, A 142.250.193.206, A 142.250.193.238, A 142.250.194.238, A 142.250.206.110, A 142.250.207.238 (487)
16:06:17.229121 00:50:56:ef:62:54 > 00:0c:29:9d:69:42, ethertype IPv4 (0x0800), length 469: 192.168.85.2.53 > 192.168.85.129.47460: 52215 5/4/8 CNAME youtube-ui.l.google.com., AAAA 2404:6800:4002:81d::200e, AAAA 2404:6800:4002:82c::200e, AAAA 2404:6800:4002:82b::200e, AAAA 2404:6800:4002:81c::200e (427)
16:06:17.229122 00:50:56:ef:62:54 > 00:0c:29:9d:69:42, ethertype IPv4 (0x0800), length 364: 192.168.85.2.53 > 192.168.85.129.34193: 15482 2/4/8 CNAME star-mini.c10r.facebook.com., A 157.240.239.35 (322)
16:06:17.229202 00:50:56:ef:62:54 > 00:0c:29:9d:69:42, ethertype IPv4 (0x0800), length 376: 192.168.85.2.53 > 192.168.85.129.33383: 2748 2/4/8 CNAME star-mini.c10r.facebook.com., AAAA 2a03:2880:f144:181:face:b00c:0:25de (334)
16:06:17.229221 00:0c:29:9d:69:42 > 00:50:56:ef:62:54, ethertype IPv4 (0x0800), length 75: 192.168.85.129.36338 > 192.168.85.2.53: 22554+ A? www.mozilla.org. (33)
16:06:17.229511 00:0c:29:9d:69:42 > 00:50:56:ef:62:54, ethertype IPv4 (0x0800), length 75: 192.168.85.129.39943 > 192.168.85.2.53: 16808+ AAAA? www.mozilla.org. (33)
16:06:17.229829 00:50:56:ef:62:54 > 00:0c:29:9d:69:42, ethertype IPv4 (0x0800), length 236: 192.168.85.2.53 > 192.168.85.129.59366: 11999 2/3/3 CNAME dyna.wikimedia.org., AAAA 2001:df2:e500:ed1a::1 (194)
16:06:17.229830 00:50:56:ef:62:54 > 00:0c:29:9d:69:42, ethertype IPv4 (0x0800), length 224: 192.168.85.2.53 > 192.168.85.129.56781: 34215 2/3/3 CNAME dyna.wikimedia.org., A 103.102.166.224 (182)
16:06:17.231721 00:50:56:ef:62:54 > 00:0c:29:9d:69:42, ethertype IPv4 (0x0800), length 3141: 34.120.237.76.443 > 192.168.85.129.50824: Flags [P.], seq 1:3088, ack 1254, win 64240, length 3087
16:06:17.231722 00:50:56:ef:62:54 > 00:0c:29:9d:69:42, ethertype IPv4 (0x0800), length 479: 192.168.85.2.53 > 192.168.85.129.60040: 6923 3/4/8 CNAME tp.47cf2c8c9-frontier.amazon.com., CNAME d3ag4hukkh62yn.cloudfront.net., A 205.251.215.216 (437)
16:06:17.231786 00:0c:29:9d:69:42 > 00:50:56:ef:62:54, ethertype IPv4 (0x0800), length 54: 192.168.85.129.50824 > 34.120.237.76.443: Flags [.], ack 3088, win 62780, length 0
16:06:17.232213 00:0c:29:9d:69:42 > 00:50:56:ef:62:54, ethertype IPv4 (0x0800), length 71: 192.168.85.129.46119 > 192.168.85.2.53: 13085+ A? twitter.com. (29)
16:06:17.233192 00:0c:29:9d:69:42 > 00:50:56:ef:62:54, ethertype IPv4 (0x0800), length 71: 192.168.85.129.54018 > 192.168.85.2.53: 12030+ AAAA? twitter.com. (29)
16:06:17.233359 00:0c:29:9d:69:42 > 00:50:56:ef:62:54, ethertype IPv4 (0x0800), length 75: 192.168.85.129.37227 > 192.168.85.2.53: 2481+ A? www.nytimes.com. (33)
16:06:17.233549 00:0c:29:9d:69:42 > 00:50:56:ef:62:54, ethertype IPv4 (0x0800), length 75: 192.168.85.129.47579 > 192.168.85.2.53: 29979+ AAAA? www.nytimes.com. (33)
