16:01:18.930529 00:0c:29:9d:69:42 > 00:50:56:ef:62:54, ethertype IPv4 (0x0800), length 74: 192.168.85.129.59602 > 185.125.190.96.80: Flags [S], seq 2693689678, win 64240, options [mss 1460,sackOK,TS val 509824754 ecr 0,nop,wscale 7], length 0
16:01:19.182078 00:50:56:ef:62:54 > 00:0c:29:9d:69:42, ethertype IPv4 (0x0800), length 60: 185.125.190.96.80 > 192.168.85.129.59602: Flags [S.], seq 240454252, ack 2693689679, win 64240, options [mss 1460], length 0
16:01:19.182220 00:0c:29:9d:69:42 > 00:50:56:ef:62:54, ethertype IPv4 (0x0800), length 54: 192.168.85.129.59602 > 185.125.190.96.80: Flags [.], ack 1, win 64240, length 0
16:01:19.182566 00:0c:29:9d:69:42 > 00:50:56:ef:62:54, ethertype IPv4 (0x0800), length 141: 192.168.85.129.59602 > 185.125.190.96.80: Flags [P.], seq 1:88, ack 1, win 64240, length 87: HTTP: GET / HTTP/1.1
16:01:19.183417 00:50:56:ef:62:54 > 00:0c:29:9d:69:42, ethertype IPv4 (0x0800), length 60: 185.125.190.96.80 > 192.168.85.129.59602: Flags [.], ack 88, win 64240, length 0
16:01:19.386521 00:50:56:ef:62:54 > 00:0c:29:9d:69:42, ethertype IPv4 (0x0800), length 239: 185.125.190.96.80 > 192.168.85.129.59602: Flags [FP.], seq 1:186, ack 88, win 64240, length 185: HTTP: HTTP/1.1 204 No Content
16:01:19.386847 00:0c:29:9d:69:42 > 00:50:56:ef:62:54, ethertype IPv4 (0x0800), length 54: 192.168.85.129.59602 > 185.125.190.96.80: Flags [F.], seq 88, ack 187, win 64054, length 0
16:01:19.387467 00:50:56:ef:62:54 > 00:0c:29:9d:69:42, ethertype IPv4 (0x0800), length 60: 185.125.190.96.80 > 192.168.85.129.59602: Flags [.], ack 89, win 64239, length 0
16:02:37.846330 00:50:56:ef:62:54 > 00:0c:29:9d:69:42, ethertype IPv4 (0x0800), length 78: 34.107.243.93.443 > 192.168.85.129.47842: Flags [P.], seq 1625582468:1625582492, ack 2548648210, win 64240, length 24
16:02:37.847517 00:0c:29:9d:69:42 > 00:50:56:ef:62:54, ethertype IPv4 (0x0800), length 82: 192.168.85.129.47842 > 34.107.243.93.443: Flags [P.], seq 1:29, ack 24, win 62780, length 28
16:02:37.847991 00:50:56:ef:62:54 > 00:0c:29:9d:69:42, ethertype IPv4 (0x0800), length 60: 34.107.243.93.443 > 192.168.85.129.47842: Flags [.], ack 29, win 64240, length 0
16:02:38.886502 00:0c:29:9d:69:42 > 00:50:56:ef:62:54, ethertype IPv4 (0x0800), length 74: 192.168.85.129.41032 > 34.117.188.166.443: Flags [S], seq 2755273553, win 64240, options [mss 1460,sackOK,TS val 2624640142 ecr 0,nop,wscale 7], length 0
16:02:39.137229 00:0c:29:9d:69:42 > 00:50:56:ef:62:54, ethertype IPv4 (0x0800), length 74: 192.168.85.129.41040 > 34.117.188.166.443: Flags [S], seq 1414728329, win 64240, options [mss 1460,sackOK,TS val 2624640392 ecr 0,nop,wscale 7], length 0
16:02:39.160669 00:50:56:ef:62:54 > 00:0c:29:9d:69:42, ethertype IPv4 (0x0800), length 60: 34.117.188.166.443 > 192.168.85.129.41040: Flags [S.], seq 1022171918, ack 1414728330, win 64240, options [mss 1460], length 0
16:02:39.160786 00:0c:29:9d:69:42 > 00:50:56:ef:62:54, ethertype IPv4 (0x0800), length 54: 192.168.85.129.41040 > 34.117.188.166.443: Flags [.], ack 1, win 64240, length 0
16:02:39.162970 00:0c:29:9d:69:42 > 00:50:56:ef:62:54, ethertype IPv4 (0x0800), length 1306: 192.168.85.129.41040 > 34.117.188.166.443: Flags [P.], seq 1:1253, ack 1, win 64240, length 1252
16:02:39.163726 00:50:56:ef:62:54 > 00:0c:29:9d:69:42, ethertype IPv4 (0x0800), length 60: 34.117.188.166.443 > 192.168.85.129.41040: Flags [.], ack 1253, win 64240, length 0
16:02:39.239828 00:50:56:ef:62:54 > 00:0c:29:9d:69:42, ethertype IPv4 (0x0800), length 60: 34.117.188.166.443 > 192.168.85.129.41032: Flags [S.], seq 2050850233, ack 2755273554, win 64240, options [mss 1460], length 0
16:02:39.239945 00:0c:29:9d:69:42 > 00:50:56:ef:62:54, ethertype IPv4 (0x0800), length 54: 192.168.85.129.41032 > 34.117.188.166.443: Flags [.], ack 1, win 64240, length 0
16:02:39.242133 00:0c:29:9d:69:42 > 00:50:56:ef:62:54, ethertype IPv4 (0x0800), length 1306: 192.168.85.129.41032 > 34.117.188.166.443: Flags [P.], seq 1:1253, ack 1, win 64240, length 1252
16:02:39.243101 00:50:56:ef:62:54 > 00:0c:29:9d:69:42, ethertype IPv4 (0x0800), length 60: 34.117.188.166.443 > 192.168.85.129.41032: Flags [.], ack 1253, win 64240, length 0
16:02:39.251821 00:50:56:ef:62:54 > 00:0c:29:9d:69:42, ethertype IPv4 (0x0800), length 3136: 34.117.188.166.443 > 192.168.85.129.41040: Flags [P.], seq 1:3083, ack 1253, win 64240, length 3082
16:02:39.251907 00:0c:29:9d:69:42 > 00:50:56:ef:62:54, ethertype IPv4 (0x0800), length 54: 192.168.85.129.41040 > 34.117.188.166.443: Flags [.], ack 3083, win 62780, length 0
16:02:39.260618 00:0c:29:9d:69:42 > 00:50:56:ef:62:54, ethertype IPv4 (0x0800), length 118: 192.168.85.129.41040 > 34.117.188.166.443: Flags [P.], seq 1253:1317, ack 3083, win 62780, length 64
16:02:39.261197 00:50:56:ef:62:54 > 00:0c:29:9d:69:42, ethertype IPv4 (0x0800), length 60: 34.117.188.166.443 > 192.168.85.129.41040: Flags [.], ack 1317, win 64240, length 0
16:02:39.263083 00:0c:29:9d:69:42 > 00:50:56:ef:62:54, ethertype IPv4 (0x0800), length 224: 192.168.85.129.41040 > 34.117.188.166.443: Flags [P.], seq 1317:1487, ack 3083, win 62780, length 170
16:02:39.264305 00:50:56:ef:62:54 > 00:0c:29:9d:69:42, ethertype IPv4 (0x0800), length 60: 34.117.188.166.443 > 192.168.85.129.41040: Flags [.], ack 1487, win 64240, length 0
16:02:39.282748 00:50:56:ef:62:54 > 00:0c:29:9d:69:42, ethertype IPv4 (0x0800), length 640: 34.117.188.166.443 > 192.168.85.129.41040: Flags [P.], seq 3083:3669, ack 1487, win 64240, length 586
16:02:39.283789 00:0c:29:9d:69:42 > 00:50:56:ef:62:54, ethertype IPv4 (0x0800), length 85: 192.168.85.129.41040 > 34.117.188.166.443: Flags [P.], seq 1487:1518, ack 3669, win 62780, length 31
16:02:39.284302 00:50:56:ef:62:54 > 00:0c:29:9d:69:42, ethertype IPv4 (0x0800), length 60: 34.117.188.166.443 > 192.168.85.129.41040: Flags [.], ack 1518, win 64240, length 0
16:02:39.303575 00:50:56:ef:62:54 > 00:0c:29:9d:69:42, ethertype IPv4 (0x0800), length 85: 34.117.188.166.443 > 192.168.85.129.41040: Flags [P.], seq 3669:3700, ack 1518, win 64240, length 31
16:02:39.344724 00:0c:29:9d:69:42 > 00:50:56:ef:62:54, ethertype IPv4 (0x0800), length 54: 192.168.85.129.41040 > 34.117.188.166.443: Flags [.], ack 3700, win 62780, length 0
16:02:39.359469 00:50:56:ef:62:54 > 00:0c:29:9d:69:42, ethertype IPv4 (0x0800), length 266: 34.117.188.166.443 > 192.168.85.129.41032: Flags [P.], seq 1:213, ack 1253, win 64240, length 212
16:02:39.359573 00:0c:29:9d:69:42 > 00:50:56:ef:62:54, ethertype IPv4 (0x0800), length 54: 192.168.85.129.41032 > 34.117.188.166.443: Flags [.], ack 213, win 64028, length 0
16:02:39.360647 00:0c:29:9d:69:42 > 00:50:56:ef:62:54, ethertype IPv4 (0x0800), length 118: 192.168.85.129.41032 > 34.117.188.166.443: Flags [P.], seq 1253:1317, ack 213, win 64028, length 64
16:02:39.361349 00:50:56:ef:62:54 > 00:0c:29:9d:69:42, ethertype IPv4 (0x0800), length 60: 34.117.188.166.443 > 192.168.85.129.41032: Flags [.], ack 1317, win 64240, length 0
16:02:39.361472 00:0c:29:9d:69:42 > 00:50:56:ef:62:54, ethertype IPv4 (0x0800), length 241: 192.168.85.129.41032 > 34.117.188.166.443: Flags [P.], seq 1317:1504, ack 213, win 64028, length 187
16:02:39.361825 00:50:56:ef:62:54 > 00:0c:29:9d:69:42, ethertype IPv4 (0x0800), length 60: 34.117.188.166.443 > 192.168.85.129.41032: Flags [.], ack 1504, win 64240, length 0
16:02:39.405572 00:50:56:ef:62:54 > 00:0c:29:9d:69:42, ethertype IPv4 (0x0800), length 672: 34.117.188.166.443 > 192.168.85.129.41032: Flags [P.], seq 213:831, ack 1504, win 64240, length 618
16:02:39.406858 00:0c:29:9d:69:42 > 00:50:56:ef:62:54, ethertype IPv4 (0x0800), length 78: 192.168.85.129.41032 > 34.117.188.166.443: Flags [P.], seq 1504:1528, ack 831, win 64028, length 24
16:02:39.407061 00:0c:29:9d:69:42 > 00:50:56:ef:62:54, ethertype IPv4 (0x0800), length 54: 192.168.85.129.41032 > 34.117.188.166.443: Flags [F.], seq 1528, ack 831, win 64028, length 0
16:02:39.407534 00:50:56:ef:62:54 > 00:0c:29:9d:69:42, ethertype IPv4 (0x0800), length 60: 34.117.188.166.443 > 192.168.85.129.41032: Flags [.], ack 1528, win 64240, length 0
16:02:39.407731 00:50:56:ef:62:54 > 00:0c:29:9d:69:42, ethertype IPv4 (0x0800), length 60: 34.117.188.166.443 > 192.168.85.129.41032: Flags [.], ack 1529, win 64239, length 0
16:02:39.900354 00:50:56:ef:62:54 > 00:0c:29:9d:69:42, ethertype IPv4 (0x0800), length 85: 34.117.188.166.443 > 192.168.85.129.41032: Flags [FP.], seq 831:862, ack 1529, win 64239, length 31
16:02:39.900397 00:0c:29:9d:69:42 > 00:50:56:ef:62:54, ethertype IPv4 (0x0800), length 54: 192.168.85.129.41032 > 34.117.188.166.443: Flags [R], seq 2755275082, win 0, length 0
16:03:39.705773 00:0c:29:9d:69:42 > 00:50:56:ef:62:54, ethertype IPv4 (0x0800), length 93: 192.168.85.129.41040 > 34.117.188.166.443: Flags [P.], seq 1518:1557, ack 3700, win 62780, length 39
16:03:39.707044 00:50:56:ef:62:54 > 00:0c:29:9d:69:42, ethertype IPv4 (0x0800), length 60: 34.117.188.166.443 > 192.168.85.129.41040: Flags [.], ack 1557, win 64240, length 0
16:03:39.724531 00:50:56:ef:62:54 > 00:0c:29:9d:69:42, ethertype IPv4 (0x0800), length 93: 34.117.188.166.443 > 192.168.85.129.41040: Flags [P.], seq 3700:3739, ack 1557, win 64240, length 39
16:03:39.724644 00:0c:29:9d:69:42 > 00:50:56:ef:62:54, ethertype IPv4 (0x0800), length 54: 192.168.85.129.41040 > 34.117.188.166.443: Flags [.], ack 3739, win 62780, length 0
16:04:38.707509 00:0c:29:9d:69:42 > 00:50:56:ef:62:54, ethertype IPv4 (0x0800), length 93: 192.168.85.129.41040 > 34.117.188.166.443: Flags [P.], seq 1557:1596, ack 3739, win 62780, length 39
16:04:38.708449 00:50:56:ef:62:54 > 00:0c:29:9d:69:42, ethertype IPv4 (0x0800), length 60: 34.117.188.166.443 > 192.168.85.129.41040: Flags [.], ack 1596, win 64240, length 0
16:04:38.729102 00:50:56:ef:62:54 > 00:0c:29:9d:69:42, ethertype IPv4 (0x0800), length 93: 34.117.188.166.443 > 192.168.85.129.41040: Flags [P.], seq 3739:3778, ack 1596, win 64240, length 39
16:04:38.729202 00:0c:29:9d:69:42 > 00:50:56:ef:62:54, ethertype IPv4 (0x0800), length 54: 192.168.85.129.41040 > 34.117.188.166.443: Flags [.], ack 3778, win 62780, length 0
16:05:29.729439 00:0c:29:9d:69:42 > 00:50:56:ef:62:54, ethertype IPv4 (0x0800), length 93: 192.168.85.129.41040 > 34.117.188.166.443: Flags [P.], seq 1596:1635, ack 3778, win 62780, length 39
16:05:29.729750 00:0c:29:9d:69:42 > 00:50:56:ef:62:54, ethertype IPv4 (0x0800), length 78: 192.168.85.129.41040 > 34.117.188.166.443: Flags [P.], seq 1635:1659, ack 3778, win 62780, length 24
16:05:29.729817 00:0c:29:9d:69:42 > 00:50:56:ef:62:54, ethertype IPv4 (0x0800), length 54: 192.168.85.129.41040 > 34.117.188.166.443: Flags [F.], seq 1659, ack 3778, win 62780, length 0
16:05:29.729918 00:50:56:ef:62:54 > 00:0c:29:9d:69:42, ethertype IPv4 (0x0800), length 60: 34.117.188.166.443 > 192.168.85.129.41040: Flags [.], ack 1635, win 64240, length 0
16:05:29.729918 00:50:56:ef:62:54 > 00:0c:29:9d:69:42, ethertype IPv4 (0x0800), length 60: 34.117.188.166.443 > 192.168.85.129.41040: Flags [.], ack 1659, win 64240, length 0
16:05:29.730008 00:50:56:ef:62:54 > 00:0c:29:9d:69:42, ethertype IPv4 (0x0800), length 60: 34.117.188.166.443 > 192.168.85.129.41040: Flags [.], ack 1660, win 64239, length 0
16:05:29.750176 00:50:56:ef:62:54 > 00:0c:29:9d:69:42, ethertype IPv4 (0x0800), length 60: 34.117.188.166.443 > 192.168.85.129.41040: Flags [FP.], seq 3778, ack 1660, win 64239, length 0
16:05:29.750215 00:0c:29:9d:69:42 > 00:50:56:ef:62:54, ethertype IPv4 (0x0800), length 54: 192.168.85.129.41040 > 34.117.188.166.443: Flags [.], ack 3779, win 62780, length 0
16:06:17.028165 00:0c:29:9d:69:42 > 00:50:56:ef:62:54, ethertype IPv4 (0x0800), length 74: 192.168.85.129.33204 > 34.36.165.17.443: Flags [S], seq 133433255, win 64240, options [mss 1460,sackOK,TS val 1136813094 ecr 0,nop,wscale 7], length 0
16:06:17.047374 00:50:56:ef:62:54 > 00:0c:29:9d:69:42, ethertype IPv4 (0x0800), length 60: 34.36.165.17.443 > 192.168.85.129.33204: Flags [S.], seq 56950882, ack 133433256, win 64240, options [mss 1460], length 0
16:06:17.047455 00:0c:29:9d:69:42 > 00:50:56:ef:62:54, ethertype IPv4 (0x0800), length 54: 192.168.85.129.33204 > 34.36.165.17.443: Flags [.], ack 1, win 64240, length 0
16:06:17.049093 00:0c:29:9d:69:42 > 00:50:56:ef:62:54, ethertype IPv4 (0x0800), length 1308: 192.168.85.129.33204 > 34.36.165.17.443: Flags [P.], seq 1:1255, ack 1, win 64240, length 1254
16:06:17.049606 00:50:56:ef:62:54 > 00:0c:29:9d:69:42, ethertype IPv4 (0x0800), length 60: 34.36.165.17.443 > 192.168.85.129.33204: Flags [.], ack 1255, win 64240, length 0
16:06:17.085717 00:0c:29:9d:69:42 > 00:50:56:ef:62:54, ethertype IPv4 (0x0800), length 74: 192.168.85.129.43206 > 34.120.208.123.443: Flags [S], seq 4221443949, win 64240, options [mss 1460,sackOK,TS val 4162564519 ecr 0,nop,wscale 7], length 0
16:06:17.112706 00:0c:29:9d:69:42 > 00:50:56:ef:62:54, ethertype IPv4 (0x0800), length 74: 192.168.85.129.50824 > 34.120.237.76.443: Flags [S], seq 49506348, win 64240, options [mss 1460,sackOK,TS val 2547267452 ecr 0,nop,wscale 7], length 0
16:06:17.124550 00:50:56:ef:62:54 > 00:0c:29:9d:69:42, ethertype IPv4 (0x0800), length 60: 34.120.208.123.443 > 192.168.85.129.43206: Flags [S.], seq 1825713402, ack 4221443950, win 64240, options [mss 1460], length 0
16:06:17.124596 00:0c:29:9d:69:42 > 00:50:56:ef:62:54, ethertype IPv4 (0x0800), length 54: 192.168.85.129.43206 > 34.120.208.123.443: Flags [.], ack 1, win 64240, length 0
16:06:17.125938 00:0c:29:9d:69:42 > 00:50:56:ef:62:54, ethertype IPv4 (0x0800), length 1292: 192.168.85.129.43206 > 34.120.208.123.443: Flags [P.], seq 1:1239, ack 1, win 64240, length 1238
16:06:17.126499 00:50:56:ef:62:54 > 00:0c:29:9d:69:42, ethertype IPv4 (0x0800), length 60: 34.120.208.123.443 > 192.168.85.129.43206: Flags [.], ack 1239, win 64240, length 0
16:06:17.133820 00:50:56:ef:62:54 > 00:0c:29:9d:69:42, ethertype IPv4 (0x0800), length 60: 34.120.237.76.443 > 192.168.85.129.50824: Flags [S.], seq 218773614, ack 49506349, win 64240, options [mss 1460], length 0
16:06:17.133863 00:0c:29:9d:69:42 > 00:50:56:ef:62:54, ethertype IPv4 (0x0800), length 54: 192.168.85.129.50824 > 34.120.237.76.443: Flags [.], ack 1, win 64240, length 0
16:06:17.136419 00:0c:29:9d:69:42 > 00:50:56:ef:62:54, ethertype IPv4 (0x0800), length 1307: 192.168.85.129.50824 > 34.120.237.76.443: Flags [P.], seq 1:1254, ack 1, win 64240, length 1253
16:06:17.136836 00:50:56:ef:62:54 > 00:0c:29:9d:69:42, ethertype IPv4 (0x0800), length 60: 34.120.237.76.443 > 192.168.85.129.50824: Flags [.], ack 1254, win 64240, length 0
16:06:17.144528 00:50:56:ef:62:54 > 00:0c:29:9d:69:42, ethertype IPv4 (0x0800), length 3174: 34.36.165.17.443 > 192.168.85.129.33204: Flags [P.], seq 1:3121, ack 1255, win 64240, length 3120
16:06:17.144556 00:0c:29:9d:69:42 > 00:50:56:ef:62:54, ethertype IPv4 (0x0800), length 54: 192.168.85.129.33204 > 34.36.165.17.443: Flags [.], ack 3121, win 61320, length 0
16:06:17.149168 00:0c:29:9d:69:42 > 00:50:56:ef:62:54, ethertype IPv4 (0x0800), length 118: 192.168.85.129.33204 > 34.36.165.17.443: Flags [P.], seq 1255:1319, ack 3121, win 62780, length 64
16:06:17.149647 00:50:56:ef:62:54 > 00:0c:29:9d:69:42, ethertype IPv4 (0x0800), length 60: 34.36.165.17.443 > 192.168.85.129.33204: Flags [.], ack 1319, win 64240, length 0
16:06:17.149693 00:0c:29:9d:69:42 > 00:50:56:ef:62:54, ethertype IPv4 (0x0800), length 224: 192.168.85.129.33204 > 34.36.165.17.443: Flags [P.], seq 1319:1489, ack 3121, win 62780, length 170
16:06:17.150004 00:50:56:ef:62:54 > 00:0c:29:9d:69:42, ethertype IPv4 (0x0800), length 60: 34.36.165.17.443 > 192.168.85.129.33204: Flags [.], ack 1489, win 64240, length 0
16:06:17.169455 00:50:56:ef:62:54 > 00:0c:29:9d:69:42, ethertype IPv4 (0x0800), length 672: 34.36.165.17.443 > 192.168.85.129.33204: Flags [P.], seq 3121:3739, ack 1489, win 64240, length 618
16:06:17.171657 00:0c:29:9d:69:42 > 00:50:56:ef:62:54, ethertype IPv4 (0x0800), length 85: 192.168.85.129.33204 > 34.36.165.17.443: Flags [P.], seq 1489:1520, ack 3739, win 62780, length 31
16:06:17.172002 00:50:56:ef:62:54 > 00:0c:29:9d:69:42, ethertype IPv4 (0x0800), length 60: 34.36.165.17.443 > 192.168.85.129.33204: Flags [.], ack 1520, win 64240, length 0
16:06:17.186606 00:50:56:ef:62:54 > 00:0c:29:9d:69:42, ethertype IPv4 (0x0800), length 85: 34.36.165.17.443 > 192.168.85.129.33204: Flags [P.], seq 3739:3770, ack 1520, win 64240, length 31
16:06:17.228587 00:0c:29:9d:69:42 > 00:50:56:ef:62:54, ethertype IPv4 (0x0800), length 54: 192.168.85.129.33204 > 34.36.165.17.443: Flags [.], ack 3770, win 62780, length 0
16:06:17.231721 00:50:56:ef:62:54 > 00:0c:29:9d:69:42, ethertype IPv4 (0x0800), length 3141: 34.120.237.76.443 > 192.168.85.129.50824: Flags [P.], seq 1:3088, ack 1254, win 64240, length 3087
16:06:17.231786 00:0c:29:9d:69:42 > 00:50:56:ef:62:54, ethertype IPv4 (0x0800), length 54: 192.168.85.129.50824 > 34.120.237.76.443: Flags [.], ack 3088, win 62780, length 0
16:06:17.237770 00:0c:29:9d:69:42 > 00:50:56:ef:62:54, ethertype IPv4 (0x0800), length 118: 192.168.85.129.50824 > 34.120.237.76.443: Flags [P.], seq 1254:1318, ack 3088, win 62780, length 64
16:06:17.238639 00:50:56:ef:62:54 > 00:0c:29:9d:69:42, ethertype IPv4 (0x0800), length 60: 34.120.237.76.443 > 192.168.85.129.50824: Flags [.], ack 1318, win 64240, length 0
16:06:17.238836 00:0c:29:9d:69:42 > 00:50:56:ef:62:54, ethertype IPv4 (0x0800), length 224: 192.168.85.129.50824 > 34.120.237.76.443: Flags [P.], seq 1318:1488, ack 3088, win 62780, length 170
16:06:17.238960 00:0c:29:9d:69:42 > 00:50:56:ef:62:54, ethertype IPv4 (0x0800), length 472: 192.168.85.129.50824 > 34.120.237.76.443: Flags [P.], seq 1488:1906, ack 3088, win 62780, length 418
16:06:17.239119 00:50:56:ef:62:54 > 00:0c:29:9d:69:42, ethertype IPv4 (0x0800), length 60: 34.120.237.76.443 > 192.168.85.129.50824: Flags [.], ack 1488, win 64240, length 0
16:06:17.239496 00:0c:29:9d:69:42 > 00:50:56:ef:62:54, ethertype IPv4 (0x0800), length 259: 192.168.85.129.50824 > 34.120.237.76.443: Flags [P.], seq 1906:2111, ack 3088, win 62780, length 205
16:06:17.239752 00:50:56:ef:62:54 > 00:0c:29:9d:69:42, ethertype IPv4 (0x0800), length 60: 34.120.237.76.443 > 192.168.85.129.50824: Flags [.], ack 1906, win 64240, length 0
16:06:17.240208 00:50:56:ef:62:54 > 00:0c:29:9d:69:42, ethertype IPv4 (0x0800), length 60: 34.120.237.76.443 > 192.168.85.129.50824: Flags [.], ack 2111, win 64240, length 0
16:06:17.240424 00:0c:29:9d:69:42 > 00:50:56:ef:62:54, ethertype IPv4 (0x0800), length 258: 192.168.85.129.50824 > 34.120.237.76.443: Flags [P.], seq 2111:2315, ack 3088, win 62780, length 204
16:06:17.240625 00:50:56:ef:62:54 > 00:0c:29:9d:69:42, ethertype IPv4 (0x0800), length 60: 34.120.237.76.443 > 192.168.85.129.50824: Flags [.], ack 2315, win 64240, length 0
16:06:17.259091 00:50:56:ef:62:54 > 00:0c:29:9d:69:42, ethertype IPv4 (0x0800), length 640: 34.120.237.76.443 > 192.168.85.129.50824: Flags [P.], seq 3088:3674, ack 2315, win 64240, length 586
16:06:17.260214 00:0c:29:9d:69:42 > 00:50:56:ef:62:54, ethertype IPv4 (0x0800), length 85: 192.168.85.129.50824 > 34.120.237.76.443: Flags [P.], seq 2315:2346, ack 3674, win 62780, length 31
16:06:17.260542 00:50:56:ef:62:54 > 00:0c:29:9d:69:42, ethertype IPv4 (0x0800), length 60: 34.120.237.76.443 > 192.168.85.129.50824: Flags [.], ack 2346, win 64240, length 0
16:06:17.280209 00:50:56:ef:62:54 > 00:0c:29:9d:69:42, ethertype IPv4 (0x0800), length 8336: 34.120.237.76.443 > 192.168.85.129.50824: Flags [P.], seq 3674:11956, ack 2346, win 64240, length 8282
16:06:17.280305 00:0c:29:9d:69:42 > 00:50:56:ef:62:54, ethertype IPv4 (0x0800), length 54: 192.168.85.129.50824 > 34.120.237.76.443: Flags [.], ack 11956, win 58400, length 0
16:06:17.282848 00:50:56:ef:62:54 > 00:0c:29:9d:69:42, ethertype IPv4 (0x0800), length 4992: 34.120.237.76.443 > 192.168.85.129.50824: Flags [P.], seq 11956:16894, ack 2346, win 64240, length 4938
16:06:17.282893 00:0c:29:9d:69:42 > 00:50:56:ef:62:54, ethertype IPv4 (0x0800), length 54: 192.168.85.129.50824 > 34.120.237.76.443: Flags [.], ack 16894, win 61320, length 0
16:06:17.283844 00:0c:29:9d:69:42 > 00:50:56:ef:62:54, ethertype IPv4 (0x0800), length 93: 192.168.85.129.50824 > 34.120.237.76.443: Flags [P.], seq 2346:2385, ack 16894, win 61320, length 39
16:06:17.284191 00:50:56:ef:62:54 > 00:0c:29:9d:69:42, ethertype IPv4 (0x0800), length 60: 34.120.237.76.443 > 192.168.85.129.50824: Flags [.], ack 2385, win 64240, length 0
16:06:17.285003 00:0c:29:9d:69:42 > 00:50:56:ef:62:54, ethertype IPv4 (0x0800), length 259: 192.168.85.129.50824 > 34.120.237.76.443: Flags [P.], seq 2385:2590, ack 16894, win 62780, length 205
16:06:17.285285 00:50:56:ef:62:54 > 00:0c:29:9d:69:42, ethertype IPv4 (0x0800), length 60: 34.120.237.76.443 > 192.168.85.129.50824: Flags [.], ack 2590, win 64240, length 0
16:06:17.286136 00:50:56:ef:62:54 > 00:0c:29:9d:69:42, ethertype IPv4 (0x0800), length 8804: 34.120.237.76.443 > 192.168.85.129.50824: Flags [P.], seq 16894:25644, ack 2590, win 64240, length 8750
16:06:17.286261 00:0c:29:9d:69:42 > 00:50:56:ef:62:54, ethertype IPv4 (0x0800), length 54: 192.168.85.129.50824 > 34.120.237.76.443: Flags [.], ack 25644, win 58400, length 0
16:06:17.289395 00:0c:29:9d:69:42 > 00:50:56:ef:62:54, ethertype IPv4 (0x0800), length 259: 192.168.85.129.50824 > 34.120.237.76.443: Flags [P.], seq 2590:2795, ack 25644, win 62780, length 205
16:06:17.289860 00:50:56:ef:62:54 > 00:0c:29:9d:69:42, ethertype IPv4 (0x0800), length 60: 34.120.237.76.443 > 192.168.85.129.50824: Flags [.], ack 2795, win 64240, length 0
16:06:17.300050 00:50:56:ef:62:54 > 00:0c:29:9d:69:42, ethertype IPv4 (0x0800), length 456: 34.120.237.76.443 > 192.168.85.129.50824: Flags [P.], seq 25644:26046, ack 2795, win 64240, length 402
16:06:17.307951 00:50:56:ef:62:54 > 00:0c:29:9d:69:42, ethertype IPv4 (0x0800), length 7218: 34.120.237.76.443 > 192.168.85.129.50824: Flags [P.], seq 26046:33210, ack 2795, win 64240, length 7164
16:06:17.308107 00:0c:29:9d:69:42 > 00:50:56:ef:62:54, ethertype IPv4 (0x0800), length 54: 192.168.85.129.50824 > 34.120.237.76.443: Flags [.], ack 33210, win 59860, length 0
16:06:17.309130 00:0c:29:9d:69:42 > 00:50:56:ef:62:54, ethertype IPv4 (0x0800), length 93: 192.168.85.129.50824 > 34.120.237.76.443: Flags [P.], seq 2795:2834, ack 33210, win 62780, length 39
16:06:17.309354 00:50:56:ef:62:54 > 00:0c:29:9d:69:42, ethertype IPv4 (0x0800), length 60: 34.120.237.76.443 > 192.168.85.129.50824: Flags [.], ack 2834, win 64240, length 0
16:06:17.322729 00:50:56:ef:62:54 > 00:0c:29:9d:69:42, ethertype IPv4 (0x0800), length 7964: 34.120.237.76.443 > 192.168.85.129.50824: Flags [P.], seq 33210:41120, ack 2834, win 64240, length 7910
16:06:17.323056 00:0c:29:9d:69:42 > 00:50:56:ef:62:54, ethertype IPv4 (0x0800), length 54: 192.168.85.129.50824 > 34.120.237.76.443: Flags [.], ack 41120, win 58400, length 0
16:06:17.325084 00:50:56:ef:62:54 > 00:0c:29:9d:69:42, ethertype IPv4 (0x0800), length 2473: 34.120.237.76.443 > 192.168.85.129.50824: Flags [P.], seq 41120:43539, ack 2834, win 64240, length 2419
16:06:17.325119 00:0c:29:9d:69:42 > 00:50:56:ef:62:54, ethertype IPv4 (0x0800), length 54: 192.168.85.129.50824 > 34.120.237.76.443: Flags [.], ack 43539, win 62780, length 0
16:06:17.398573 00:0c:29:9d:69:42 > 00:50:56:ef:62:54, ethertype IPv4 (0x0800), length 258: 192.168.85.129.50824 > 34.120.237.76.443: Flags [P.], seq 2834:3038, ack 43539, win 62780, length 204
16:06:17.398974 00:50:56:ef:62:54 > 00:0c:29:9d:69:42, ethertype IPv4 (0x0800), length 60: 34.120.237.76.443 > 192.168.85.129.50824: Flags [.], ack 3038, win 64240, length 0
16:06:17.399129 00:0c:29:9d:69:42 > 00:50:56:ef:62:54, ethertype IPv4 (0x0800), length 258: 192.168.85.129.50824 > 34.120.237.76.443: Flags [P.], seq 3038:3242, ack 43539, win 62780, length 204
16:06:17.399504 00:50:56:ef:62:54 > 00:0c:29:9d:69:42, ethertype IPv4 (0x0800), length 60: 34.120.237.76.443 > 192.168.85.129.50824: Flags [.], ack 3242, win 64240, length 0
16:06:17.401304 00:0c:29:9d:69:42 > 00:50:56:ef:62:54, ethertype IPv4 (0x0800), length 258: 192.168.85.129.50824 > 34.120.237.76.443: Flags [P.], seq 3242:3446, ack 43539, win 62780, length 204
16:06:17.401612 00:50:56:ef:62:54 > 00:0c:29:9d:69:42, ethertype IPv4 (0x0800), length 60: 34.120.237.76.443 > 192.168.85.129.50824: Flags [.], ack 3446, win 64240, length 0
16:06:17.402741 00:0c:29:9d:69:42 > 00:50:56:ef:62:54, ethertype IPv4 (0x0800), length 259: 192.168.85.129.50824 > 34.120.237.76.443: Flags [P.], seq 3446:3651, ack 43539, win 62780, length 205
16:06:17.403315 00:50:56:ef:62:54 > 00:0c:29:9d:69:42, ethertype IPv4 (0x0800), length 60: 34.120.237.76.443 > 192.168.85.129.50824: Flags [.], ack 3651, win 64240, length 0
16:06:17.425831 00:50:56:ef:62:54 > 00:0c:29:9d:69:42, ethertype IPv4 (0x0800), length 10024: 34.120.237.76.443 > 192.168.85.129.50824: Flags [P.], seq 43539:53509, ack 3651, win 64240, length 9970
16:06:17.425958 00:0c:29:9d:69:42 > 00:50:56:ef:62:54, ethertype IPv4 (0x0800), length 54: 192.168.85.129.50824 > 34.120.237.76.443: Flags [.], ack 53509, win 58400, length 0
16:06:17.426842 00:0c:29:9d:69:42 > 00:50:56:ef:62:54, ethertype IPv4 (0x0800), length 93: 192.168.85.129.50824 > 34.120.237.76.443: Flags [P.], seq 3651:3690, ack 53509, win 62780, length 39
16:06:17.427259 00:50:56:ef:62:54 > 00:0c:29:9d:69:42, ethertype IPv4 (0x0800), length 60: 34.120.237.76.443 > 192.168.85.129.50824: Flags [.], ack 3690, win 64240, length 0
16:06:17.449776 00:50:56:ef:62:54 > 00:0c:29:9d:69:42, ethertype IPv4 (0x0800), length 7965: 34.120.237.76.443 > 192.168.85.129.50824: Flags [P.], seq 53509:61420, ack 3690, win 64240, length 7911
16:06:17.449779 00:50:56:ef:62:54 > 00:0c:29:9d:69:42, ethertype IPv4 (0x0800), length 5054: 34.120.237.76.443 > 192.168.85.129.50824: Flags [P.], seq 61420:66420, ack 3690, win 64240, length 5000
16:06:17.450017 00:0c:29:9d:69:42 > 00:50:56:ef:62:54, ethertype IPv4 (0x0800), length 54: 192.168.85.129.50824 > 34.120.237.76.443: Flags [.], ack 66420, win 55480, length 0
16:06:17.453053 00:50:56:ef:62:54 > 00:0c:29:9d:69:42, ethertype IPv4 (0x0800), length 7554: 34.120.237.76.443 > 192.168.85.129.50824: Flags [P.], seq 66420:73920, ack 3690, win 64240, length 7500
16:06:17.453127 00:0c:29:9d:69:42 > 00:50:56:ef:62:54, ethertype IPv4 (0x0800), length 54: 192.168.85.129.50824 > 34.120.237.76.443: Flags [.], ack 73920, win 58400, length 0
16:06:17.453803 00:50:56:ef:62:54 > 00:0c:29:9d:69:42, ethertype IPv4 (0x0800), length 5054: 34.120.237.76.443 > 192.168.85.129.50824: Flags [P.], seq 73920:78920, ack 3690, win 64240, length 5000
16:06:17.453893 00:0c:29:9d:69:42 > 00:50:56:ef:62:54, ethertype IPv4 (0x0800), length 54: 192.168.85.129.50824 > 34.120.237.76.443: Flags [.], ack 78920, win 65535, length 0
16:06:17.458726 00:50:56:ef:62:54 > 00:0c:29:9d:69:42, ethertype IPv4 (0x0800), length 1117: 34.120.237.76.443 > 192.168.85.129.50824: Flags [P.], seq 78920:79983, ack 3690, win 64240, length 1063
16:06:17.487429 00:50:56:ef:62:54 > 00:0c:29:9d:69:42, ethertype IPv4 (0x0800), length 266: 34.120.208.123.443 > 192.168.85.129.43206: Flags [P.], seq 1:213, ack 1239, win 64240, length 212
16:06:17.487511 00:0c:29:9d:69:42 > 00:50:56:ef:62:54, ethertype IPv4 (0x0800), length 54: 192.168.85.129.43206 > 34.120.208.123.443: Flags [.], ack 213, win 64028, length 0
16:06:17.488769 00:0c:29:9d:69:42 > 00:50:56:ef:62:54, ethertype IPv4 (0x0800), length 118: 192.168.85.129.43206 > 34.120.208.123.443: Flags [P.], seq 1239:1303, ack 213, win 64028, length 64
16:06:17.489630 00:50:56:ef:62:54 > 00:0c:29:9d:69:42, ethertype IPv4 (0x0800), length 60: 34.120.208.123.443 > 192.168.85.129.43206: Flags [.], ack 1303, win 64240, length 0
16:06:17.489672 00:0c:29:9d:69:42 > 00:50:56:ef:62:54, ethertype IPv4 (0x0800), length 224: 192.168.85.129.43206 > 34.120.208.123.443: Flags [P.], seq 1303:1473, ack 213, win 64028, length 170
16:06:17.489859 00:0c:29:9d:69:42 > 00:50:56:ef:62:54, ethertype IPv4 (0x0800), length 473: 192.168.85.129.43206 > 34.120.208.123.443: Flags [P.], seq 1473:1892, ack 213, win 64028, length 419
16:06:17.490024 00:0c:29:9d:69:42 > 00:50:56:ef:62:54, ethertype IPv4 (0x0800), length 1115: 192.168.85.129.43206 > 34.120.208.123.443: Flags [P.], seq 1892:2953, ack 213, win 64028, length 1061
16:06:17.490150 00:50:56:ef:62:54 > 00:0c:29:9d:69:42, ethertype IPv4 (0x0800), length 60: 34.120.208.123.443 > 192.168.85.129.43206: Flags [.], ack 1473, win 64240, length 0
16:06:17.490151 00:50:56:ef:62:54 > 00:0c:29:9d:69:42, ethertype IPv4 (0x0800), length 60: 34.120.208.123.443 > 192.168.85.129.43206: Flags [.], ack 1892, win 64240, length 0
16:06:17.490855 00:50:56:ef:62:54 > 00:0c:29:9d:69:42, ethertype IPv4 (0x0800), length 60: 34.120.208.123.443 > 192.168.85.129.43206: Flags [.], ack 2953, win 64240, length 0
16:06:17.500672 00:0c:29:9d:69:42 > 00:50:56:ef:62:54, ethertype IPv4 (0x0800), length 54: 192.168.85.129.50824 > 34.120.237.76.443: Flags [.], ack 79983, win 65535, length 0
16:06:17.526075 00:50:56:ef:62:54 > 00:0c:29:9d:69:42, ethertype IPv4 (0x0800), length 640: 34.120.208.123.443 > 192.168.85.129.43206: Flags [P.], seq 213:799, ack 2953, win 64240, length 586
16:06:17.527139 00:0c:29:9d:69:42 > 00:50:56:ef:62:54, ethertype IPv4 (0x0800), length 85: 192.168.85.129.43206 > 34.120.208.123.443: Flags [P.], seq 2953:2984, ack 799, win 64028, length 31
16:06:17.527707 00:50:56:ef:62:54 > 00:0c:29:9d:69:42, ethertype IPv4 (0x0800), length 60: 34.120.208.123.443 > 192.168.85.129.43206: Flags [.], ack 2984, win 64240, length 0
16:06:17.867761 00:50:56:ef:62:54 > 00:0c:29:9d:69:42, ethertype IPv4 (0x0800), length 1014: 34.120.208.123.443 > 192.168.85.129.43206: Flags [P.], seq 799:1759, ack 2984, win 64240, length 960
16:06:17.908649 00:0c:29:9d:69:42 > 00:50:56:ef:62:54, ethertype IPv4 (0x0800), length 54: 192.168.85.129.43206 > 34.120.208.123.443: Flags [.], ack 1759, win 64028, length 0
16:06:18.641164 00:50:56:ef:62:54 > 00:0c:29:9d:69:42, ethertype IPv4 (0x0800), length 93: 34.120.208.123.443 > 192.168.85.129.43206: Flags [P.], seq 1759:1798, ack 2984, win 64240, length 39
16:06:18.641187 00:0c:29:9d:69:42 > 00:50:56:ef:62:54, ethertype IPv4 (0x0800), length 54: 192.168.85.129.43206 > 34.120.208.123.443: Flags [.], ack 1798, win 64028, length 0
16:06:18.641373 00:0c:29:9d:69:42 > 00:50:56:ef:62:54, ethertype IPv4 (0x0800), length 93: 192.168.85.129.43206 > 34.120.208.123.443: Flags [P.], seq 2984:3023, ack 1798, win 64028, length 39
16:06:18.641756 00:50:56:ef:62:54 > 00:0c:29:9d:69:42, ethertype IPv4 (0x0800), length 60: 34.120.208.123.443 > 192.168.85.129.43206: Flags [.], ack 3023, win 64240, length 0
16:06:18.927084 00:0c:29:9d:69:42 > 00:50:56:ef:62:54, ethertype IPv4 (0x0800), length 74: 192.168.85.129.38470 > 185.125.190.97.80: Flags [S], seq 2000467384, win 64240, options [mss 1460,sackOK,TS val 330574227 ecr 0,nop,wscale 7], length 0
16:06:19.152578 00:50:56:ef:62:54 > 00:0c:29:9d:69:42, ethertype IPv4 (0x0800), length 60: 185.125.190.97.80 > 192.168.85.129.38470: Flags [S.], seq 200746730, ack 2000467385, win 64240, options [mss 1460], length 0
16:06:19.152628 00:0c:29:9d:69:42 > 00:50:56:ef:62:54, ethertype IPv4 (0x0800), length 54: 192.168.85.129.38470 > 185.125.190.97.80: Flags [.], ack 1, win 64240, length 0
16:06:19.152784 00:0c:29:9d:69:42 > 00:50:56:ef:62:54, ethertype IPv4 (0x0800), length 141: 192.168.85.129.38470 > 185.125.190.97.80: Flags [P.], seq 1:88, ack 1, win 64240, length 87: HTTP: GET / HTTP/1.1
16:06:19.153194 00:50:56:ef:62:54 > 00:0c:29:9d:69:42, ethertype IPv4 (0x0800), length 60: 185.125.190.97.80 > 192.168.85.129.38470: Flags [.], ack 88, win 64240, length 0
16:06:19.276581 00:50:56:ef:62:54 > 00:0c:29:9d:69:42, ethertype IPv4 (0x0800), length 278: 192.168.85.2.53 > 192.168.85.129.47992: 10799 2/4/4 CNAME dualstack.guardian.map.fastly.net., A 199.232.21.111 (236)
16:06:19.276581 00:50:56:ef:62:54 > 00:0c:29:9d:69:42, ethertype IPv4 (0x0800), length 290: 192.168.85.2.53 > 192.168.85.129.60439: 53832 2/4/4 CNAME dualstack.guardian.map.fastly.net., AAAA 2a04:4e42:42::367 (248)
16:06:19.351231 00:50:56:ef:62:54 > 00:0c:29:9d:69:42, ethertype IPv4 (0x0800), length 239: 185.125.190.97.80 > 192.168.85.129.38470: Flags [FP.], seq 1:186, ack 88, win 64240, length 185: HTTP: HTTP/1.1 204 No Content
16:06:19.351354 00:0c:29:9d:69:42 > 00:50:56:ef:62:54, ethertype IPv4 (0x0800), length 54: 192.168.85.129.38470 > 185.125.190.97.80: Flags [F.], seq 88, ack 187, win 64054, length 0
16:06:19.351851 00:50:56:ef:62:54 > 00:0c:29:9d:69:42, ethertype IPv4 (0x0800), length 60: 185.125.190.97.80 > 192.168.85.129.38470: Flags [.], ack 89, win 64239, length 0
16:06:20.168941 00:0c:29:9d:69:42 > 00:50:56:ef:62:54, ethertype IPv4 (0x0800), length 74: 192.168.85.129.36326 > 142.250.194.238.443: Flags [S], seq 297442891, win 64240, options [mss 1460,sackOK,TS val 2251322472 ecr 0,nop,wscale 7], length 0
16:06:20.375730 00:0c:29:9d:69:42 > 00:50:56:ef:62:54, ethertype IPv4 (0x0800), length 74: 192.168.85.129.36328 > 142.250.194.238.443: Flags [S], seq 3944624184, win 64240, options [mss 1460,sackOK,TS val 2251322679 ecr 0,nop,wscale 7], length 0
16:06:20.378843 00:0c:29:9d:69:42 > 00:50:56:ef:62:54, ethertype IPv4 (0x0800), length 74: 192.168.85.129.36342 > 142.250.194.238.443: Flags [S], seq 3009849216, win 64240, options [mss 1460,sackOK,TS val 2251322682 ecr 0,nop,wscale 7], length 0
16:06:20.399096 00:50:56:ef:62:54 > 00:0c:29:9d:69:42, ethertype IPv4 (0x0800), length 60: 142.250.194.238.443 > 192.168.85.129.36328: Flags [S.], seq 1735950110, ack 3944624185, win 64240, options [mss 1460], length 0
16:06:20.399128 00:0c:29:9d:69:42 > 00:50:56:ef:62:54, ethertype IPv4 (0x0800), length 54: 192.168.85.129.36328 > 142.250.194.238.443: Flags [.], ack 1, win 64240, length 0
16:06:20.399965 00:0c:29:9d:69:42 > 00:50:56:ef:62:54, ethertype IPv4 (0x0800), length 717: 192.168.85.129.36328 > 142.250.194.238.443: Flags [P.], seq 1:664, ack 1, win 64240, length 663
16:06:20.400649 00:50:56:ef:62:54 > 00:0c:29:9d:69:42, ethertype IPv4 (0x0800), length 60: 142.250.194.238.443 > 192.168.85.129.36328: Flags [.], ack 664, win 64240, length 0
16:06:20.494662 00:50:56:ef:62:54 > 00:0c:29:9d:69:42, ethertype IPv4 (0x0800), length 6889: 142.250.194.238.443 > 192.168.85.129.36328: Flags [P.], seq 1:6836, ack 664, win 64240, length 6835
16:06:20.494697 00:0c:29:9d:69:42 > 00:50:56:ef:62:54, ethertype IPv4 (0x0800), length 54: 192.168.85.129.36328 > 142.250.194.238.443: Flags [.], ack 6836, win 59860, length 0
16:06:20.494835 00:50:56:ef:62:54 > 00:0c:29:9d:69:42, ethertype IPv4 (0x0800), length 60: 142.250.194.238.443 > 192.168.85.129.36326: Flags [S.], seq 291007599, ack 297442892, win 64240, options [mss 1460], length 0
16:06:20.494864 00:0c:29:9d:69:42 > 00:50:56:ef:62:54, ethertype IPv4 (0x0800), length 54: 192.168.85.129.36326 > 142.250.194.238.443: Flags [.], ack 1, win 64240, length 0
16:06:20.498603 00:0c:29:9d:69:42 > 00:50:56:ef:62:54, ethertype IPv4 (0x0800), length 717: 192.168.85.129.36326 > 142.250.194.238.443: Flags [P.], seq 1:664, ack 1, win 64240, length 663
16:06:20.499204 00:50:56:ef:62:54 > 00:0c:29:9d:69:42, ethertype IPv4 (0x0800), length 60: 142.250.194.238.443 > 192.168.85.129.36326: Flags [.], ack 664, win 64240, length 0
16:06:20.513016 00:0c:29:9d:69:42 > 00:50:56:ef:62:54, ethertype IPv4 (0x0800), length 74: 192.168.85.129.53798 > 142.250.192.195.80: Flags [S], seq 1933744053, win 64240, options [mss 1460,sackOK,TS val 3353990967 ecr 0,nop,wscale 7], length 0
16:06:20.533450 00:50:56:ef:62:54 > 00:0c:29:9d:69:42, ethertype IPv4 (0x0800), length 60: 142.250.192.195.80 > 192.168.85.129.53798: Flags [S.], seq 1809386135, ack 1933744054, win 64240, options [mss 1460], length 0
16:06:20.533556 00:0c:29:9d:69:42 > 00:50:56:ef:62:54, ethertype IPv4 (0x0800), length 54: 192.168.85.129.53798 > 142.250.192.195.80: Flags [.], ack 1, win 64240, length 0
16:06:20.534243 00:0c:29:9d:69:42 > 00:50:56:ef:62:54, ethertype IPv4 (0x0800), length 495: 192.168.85.129.53798 > 142.250.192.195.80: Flags [P.], seq 1:442, ack 1, win 64240, length 441: HTTP: POST /gts1c3 HTTP/1.1
16:06:20.534610 00:50:56:ef:62:54 > 00:0c:29:9d:69:42, ethertype IPv4 (0x0800), length 60: 142.250.192.195.80 > 192.168.85.129.53798: Flags [.], ack 442, win 64240, length 0
16:06:20.584743 00:50:56:ef:62:54 > 00:0c:29:9d:69:42, ethertype IPv4 (0x0800), length 6890: 142.250.194.238.443 > 192.168.85.129.36326: Flags [P.], seq 1:6837, ack 664, win 64240, length 6836
16:06:20.584783 00:0c:29:9d:69:42 > 00:50:56:ef:62:54, ethertype IPv4 (0x0800), length 54: 192.168.85.129.36326 > 142.250.194.238.443: Flags [.], ack 6837, win 59860, length 0
16:06:20.595401 00:0c:29:9d:69:42 > 00:50:56:ef:62:54, ethertype IPv4 (0x0800), length 74: 192.168.85.129.53810 > 142.250.192.195.80: Flags [S], seq 503729833, win 64240, options [mss 1460,sackOK,TS val 3353991049 ecr 0,nop,wscale 7], length 0
16:06:20.616397 00:50:56:ef:62:54 > 00:0c:29:9d:69:42, ethertype IPv4 (0x0800), length 60: 142.250.192.195.80 > 192.168.85.129.53810: Flags [S.], seq 1222465720, ack 503729834, win 64240, options [mss 1460], length 0
16:06:20.616598 00:0c:29:9d:69:42 > 00:50:56:ef:62:54, ethertype IPv4 (0x0800), length 54: 192.168.85.129.53810 > 142.250.192.195.80: Flags [.], ack 1, win 64240, length 0
16:06:20.617059 00:0c:29:9d:69:42 > 00:50:56:ef:62:54, ethertype IPv4 (0x0800), length 495: 192.168.85.129.53810 > 142.250.192.195.80: Flags [P.], seq 1:442, ack 1, win 64240, length 441: HTTP: POST /gts1c3 HTTP/1.1
16:06:20.617658 00:50:56:ef:62:54 > 00:0c:29:9d:69:42, ethertype IPv4 (0x0800), length 60: 142.250.192.195.80 > 192.168.85.129.53810: Flags [.], ack 442, win 64240, length 0
16:06:20.626991 00:50:56:ef:62:54 > 00:0c:29:9d:69:42, ethertype IPv4 (0x0800), length 755: 142.250.192.195.80 > 192.168.85.129.53798: Flags [P.], seq 1:702, ack 442, win 64240, length 701: HTTP: HTTP/1.1 200 OK
16:06:20.627040 00:0c:29:9d:69:42 > 00:50:56:ef:62:54, ethertype IPv4 (0x0800), length 54: 192.168.85.129.53798 > 142.250.192.195.80: Flags [.], ack 702, win 63791, length 0
16:06:20.628798 00:0c:29:9d:69:42 > 00:50:56:ef:62:54, ethertype IPv4 (0x0800), length 118: 192.168.85.129.36328 > 142.250.194.238.443: Flags [P.], seq 664:728, ack 6836, win 62780, length 64
16:06:20.629272 00:50:56:ef:62:54 > 00:0c:29:9d:69:42, ethertype IPv4 (0x0800), length 60: 142.250.194.238.443 > 192.168.85.129.36328: Flags [.], ack 728, win 64240, length 0
16:06:20.629968 00:0c:29:9d:69:42 > 00:50:56:ef:62:54, ethertype IPv4 (0x0800), length 224: 192.168.85.129.36328 > 142.250.194.238.443: Flags [P.], seq 728:898, ack 6836, win 62780, length 170
16:06:20.630228 00:0c:29:9d:69:42 > 00:50:56:ef:62:54, ethertype IPv4 (0x0800), length 396: 192.168.85.129.36328 > 142.250.194.238.443: Flags [P.], seq 898:1240, ack 6836, win 62780, length 342
16:06:20.630512 00:50:56:ef:62:54 > 00:0c:29:9d:69:42, ethertype IPv4 (0x0800), length 60: 142.250.194.238.443 > 192.168.85.129.36328: Flags [.], ack 898, win 64240, length 0
16:06:20.630688 00:50:56:ef:62:54 > 00:0c:29:9d:69:42, ethertype IPv4 (0x0800), length 60: 142.250.194.238.443 > 192.168.85.129.36328: Flags [.], ack 1240, win 64240, length 0
16:06:20.650440 00:50:56:ef:62:54 > 00:0c:29:9d:69:42, ethertype IPv4 (0x0800), length 668: 142.250.194.238.443 > 192.168.85.129.36328: Flags [P.], seq 6836:7450, ack 1240, win 64240, length 614
16:06:20.650486 00:0c:29:9d:69:42 > 00:50:56:ef:62:54, ethertype IPv4 (0x0800), length 54: 192.168.85.129.36328 > 142.250.194.238.443: Flags [.], ack 7450, win 62780, length 0
16:06:20.651460 00:0c:29:9d:69:42 > 00:50:56:ef:62:54, ethertype IPv4 (0x0800), length 85: 192.168.85.129.36328 > 142.250.194.238.443: Flags [P.], seq 1240:1271, ack 7450, win 62780, length 31
16:06:20.651970 00:50:56:ef:62:54 > 00:0c:29:9d:69:42, ethertype IPv4 (0x0800), length 60: 142.250.194.238.443 > 192.168.85.129.36328: Flags [.], ack 1271, win 64240, length 0
16:06:20.673462 00:50:56:ef:62:54 > 00:0c:29:9d:69:42, ethertype IPv4 (0x0800), length 85: 142.250.194.238.443 > 192.168.85.129.36328: Flags [P.], seq 7450:7481, ack 1271, win 64240, length 31
